	eng	ukr
104741	Tom said that I looked concerned.	Том сказав, що в мене стурбований вигляд.
88711	Tom's lights were on.	У Тома було включене світло.
9631	Tom is a fishmonger.	Том - продавець риби.
127370	Tom got Mary to lend him some money.	Том умовив Мері позичити йому гроші.
122034	You should always tell the truth.	Завжди треба казати правду.
79212	Tom got Mary to drive.	Том попросив Мері покермувати.
74006	That won't solve anything.	Це нічого не вирішить.
152354	Tom said that you're not a real doctor.	Том сказав, що ви несправжній лікар.
7869	I never put sugar in my coffee.	Я ніколи не кладу цукор до кави.
82879	I know that this is none of my business.	Я знаю, що це мене не стосується.
89435	We won all three games.	Ми виграли всі три гри.
43672	I'm glad you're coming.	Я радий, що ти приїдеш.
73029	I'm the owner.	Власник — це я.
3542	He quarreled with his wife about their children.	Він полаявся з дружиною через дітей.
37719	She teaches us French.	Вона викладає нам французьку.
89470	Tom hasn't washed his car yet.	Том ще не помив машину.
22128	Tom opened his present.	Том відкрив свій подарунок.
59334	I'm doing all I can.	Я роблю все, що можу.
83168	Were you at school at that time?	Ти був у школі у той час?
108435	Tom's phone started vibrating.	У Тома завібрував телефон.
133321	I listen to jazz sometimes.	Я іноді слухаю джаз.
49760	You're not my son.	Ви не мій син.
154324	How can you not know?	Як ти можеш не знати?
62934	That isn't a cat. It's a dog.	Це не кішка, а собака.
64527	I'll tell Tom that when he comes back.	Я скажу це Тому, коли він повернеться.
42424	Tomorrow is my birthday.	Завтра у мене день народження.
120722	Did he tell you the truth?	Він сказав тобі правду?
96482	Who said Tom could join the team?	Хто сказав, що Том може вступити до команди?
30513	I packed Tom's suitcase for him.	Я зібрав за Тома його валізу.
127821	Can I borrow your earphones?	Можна позичити твої навушники?
33645	I don't like to eat garlic in the morning.	Я не люблю їсти вранці часник.
20100	We can start over again.	Ми можемо знову почати з початку.
18873	Tom talked with me.	Том розмовляв зі мною.
113693	I saw a girl with long hair.	Я бачила дівчину з довгим волоссям.
40592	I only saw him once.	Я бачив його лише раз.
110732	Tom knows that he can trust us.	Том знає, що може нам довіряти.
113399	You could try and be a bit more civilized.	Ти міг би спробувати і бути трішечки цивілізованішим.
28910	I drink quite a bit.	Я досить багато п'ю.
30267	Tom was told not to do that anymore.	Тому сказали більше цим не займатися.
119842	May I hold your hand?	Можна взяти вас за руку?
36395	I feel your pain.	Я поділяю ваш біль.
117271	Tom didn't require medical attention.	Том не потребував уваги лікарів.
48625	Tom didn't kill anybody.	Том нікого не вбив.
94869	Tom will never acquiesce.	Том ніколи не згодиться.
5500	I can't help anymore.	Я більше не можу допомогти.
120824	Tom is sure Mary was lying.	Том певен, що Мері казала неправду.
105473	Tom hugged Mary and then kissed her.	Том обійняв і поцілував Мері.
22868	Tom ordered beer for himself and red wine for Mary.	Том замовив пиво для себе та червоне вино для Мері.
20160	I'm not good at French.	Я не дуже добре знаю французьку.
5537	Tom is hiding from Mary.	Том ховається від Мері.
46295	I'll show you a few photos.	Я покажу тобі кілька фотографій.
58270	I think that's the best plan.	Думаю, це найкращий план.
93257	You're a little too young for me.	Ви для мене трохи замолода.
27273	I don't think that Tom is as creative as Mary.	Я не думаю, що Том настільки креативний, як Мері.
50967	My parents persuaded me not to travel alone.	Мої батьки переконали мене не подорожувати самій.
18809	Never in my life have I seen such a terrible accident.	Ніколи в житті я не бачив таку жахливу аварію.
117127	Tom won't believe us.	Том нам не повірить.
153884	I have no idea what that was.	Я уяви не маю, що то було.
64486	Tom needs some time.	Тому потрібно трохи часу.
111588	My son is now as tall as I am.	Мій син тепер такий саме високий, як і я.
61672	Tom wanted to go, too.	Том теж хотів піти.
9056	I was waiting for Tom to tell me what to do.	Я чекав на Тома, що він сказав мені, що робити.
111078	I expect you to treat Tom with respect.	Я розраховую, що ти будеш ставитися до Тома з повагою.
150807	She's my first love.	Вона моє перше кохання.
131461	We'll begin work soon.	Скоро ми розпочнемо роботу.
132287	I think Tom will like it.	Гадаю, Тому вона сподобається.
45652	How do you know I don't have it?	Звідки ти знаєш, що у мене його немає?
17615	I'm sure I can help you.	Я певна, що можу вам допомогти.
107348	I don't know her, nor do I want to.	Не знаю і знати не хочу.
36288	Sorry. It's all my fault.	Перепрошую. Це все моя провина.
136779	I got the ticket free of charge.	Я отримав квиток безкоштовно.
18537	It's Tom's birthday today.	Сьогодні день народження Тома.
11063	I studied last night.	Я вчився цієї ночі.
2269	Tom can't even pretend to like Mary.	Том не може навіть зробити вигляд, що йому подобається Мері.
24644	No matter what you say, I won't change my mind.	Що б ти не казав, я не передумаю.
129137	She read one poem to him.	Вона прочитала йому один вірш.
6222	You've got the right to be happy.	Ви маєте право бути щасливою.
64025	Tom hasn't seen Mary in years.	Том не бачив Мері вже кілька років.
69285	I suspect that Tom and Mary are tired.	Я підозрюю, що Том із Мері втомилися.
61793	I don't think I know the answer.	Я не думаю, що я знаю відповідь.
153499	I ran out of food.	У меге закінчилася їжа.
148483	The sun doesn't shine at night.	Вночі сонце не світить.
81053	You may answer the question.	Можеш відповідати на запитання.
145129	I didn't know you were that kind of a person.	Я не знав, що ти такий.
151478	How much candy do you have left?	Скільки у вас лишилося цукерок?
124556	To put it frankly, he is a critic rather than a writer.	Відверто кажучи, він скоріше критик, ніж письменник.
90110	We may need help.	Ми можемо потребувати допомоги.
148450	She likes short skirts.	Їй подобаються короткі спідниці.
27892	Tom said that he didn't know why Mary was so angry.	Том сказав, що не знає, чому Мері така сердита.
131557	We have three children.	Ми маємо трьох дітей.
81359	Tom told everyone he was ticklish.	Том розповів усім, що боїться лоскоту.
94534	I went to bed last night at eleven.	Я пішла спати вчора об одинадцятій.
38256	Where did you get that idea?	Звідки у вас ця ідея?
46535	Tom is right behind Mary.	Том просто за Мері.
106981	I don't have any small change.	У мене взагалі немає дрібних грошей.
6864	Tom's fingers are really long.	У Тома дуже довгі пальці.
78200	Tom is just looking for Mary.	Том просто шукає Мері.
78579	Do we have to do all this?	Ми мусимо це все робити?
108816	Tom is smarter than Mary is.	Том розумніший за Мері.
1844	Who are you hiding from?	Від кого ви ховаєтеся?
43054	You can use my pen.	Ви можете скористатися моєю ручкою.
55190	Do you really think Tom is in Australia?	Ви й насправді думаєте, що Том у Австралії?
58285	I'm still here in Boston.	Я все ще тут у Бостоні.
101729	My father runs a restaurant.	Мій батько керує рестораном.
131936	Tom is quite naive, isn't he?	Том досить-таки наївний, еге ж?
48351	I don't know much about you.	Я про вас небагато знаю.
33250	I wonder whether or not Tom has ever asked Mary why she didn't do that.	Мені цікаво, чи Том колись питав Мері, чому вона цього не зробила.
56817	Don't forget your toothbrush.	Не забудьте зубну щітку.
10312	Berlin is in Germany.	Берлін знаходиться у Німеччині.
123274	Tom checked the answering machine for messages.	Том перевірив, чи є повідомлення на автовідповідачу.
47566	You're exaggerating, right?	Ти перебільшуєш, так?
62939	Tom and Mary are cousins.	Том та Мері — двоюрідні брат та сестра.
22935	I don't want to talk about that.	Я не хочу про це говорити.
44185	She made me a star.	Вона зробила з мене зірку.
54198	I wake up early in the morning.	Я прокидаюся рано вранці.
125036	Tom thought that we could win.	Том думав, що ми можемо виграти.
105351	Tell Tom you lied.	Скажи Тому, що ти збрехав.
110265	Have you washed the car yet?	Ти вже помив машину?
4569	You should have attended the meeting.	Ти мусив би відвідати зустріч.
97208	I was already married at your age.	У твоєму віці я вже був одружений.
50311	I don't like tea.	Я не люблю чай.
107238	Tomorrow there's a high probability it'll rain.	Сьогодні висока ймовірність дощу.
5262	I'd love to go fishing with you.	Я би дуже хотів піти з тобою на рибаловлю.
77134	Is there any salad oil in the bottle?	У пляшці лишилася салатна олія?
20970	He can read well.	Він уміє добре читати.
4148	Cheer him up when you see him.	Підбадьор його, коли побачиш.
76914	Obviously, I like beer.	Звичайно ж, я люблю пиво.
118481	Spiders prey on flies and other small insects.	Павуки полюють на мух та інших дрібних комах.
114104	What happened after Tom did that?	Що трапилося після того, як Том це зробив.
111363	I don't know how many brothers and sisters Tom has.	Я не знаю, скільки у Тома братів та сестер.
75152	Didn't I tell you to stay at home?	Хіба я не сказала тобі залишатися вдома?
1326	Tom is very lazy, isn't he?	Том дуже ледачий, так?
106961	Did you give Tom something to eat?	Ти дав Тому щось поїсти?
71426	He rejected our offer.	Він відхилив нашу пропозицію.
58852	I still have questions I want to ask you.	У мене все ще є питання, які я хочу тобі поставити.
118693	Tom told me that he lived on Park Street.	Том сказав мені, що живе на Парковій вулиці.
46289	Tom has made several bad decisions recently.	Том нещодавно прийняв кілька поганих рішень.
15312	Tom said he thought that Mary was nervous.	Том сказав, що, на його думку, Мері нервує.
30452	When did Tom live in Australia?	Коли Том жив у Австралії?
39321	Do you think Tom will actually win?	Гадаєш, Том насправді переможе?
29575	I know Tom is a bit taller than Mary is.	Я знаю, що Том трохи вищий від Мері.
154503	My hands are cold.	У мене змерзли руки.
102149	I know that Tom isn't a rabbi.	Я знаю, що Том не рабин.
23263	I'm glad they're both on our team.	Радий, що вони обоє в нашій команді.
2117	I want to learn Chinese next year.	Я бажаю вивчати китайську наступного року.
96807	He's got terrible handwriting.	У нього дуже поганий почерк.
125929	Tom isn't on a diet.	Том не на дієті.
101014	I wish that Tom could go to Australia with me.	Шкода, що Том не може поїхати зі мною до Австралії.
102289	You're too suspicious about everything.	Ти дуже підозрілий щодо всього.
68791	This rule does not apply.	Це правило тут не діє.
57032	Come on, Tom. It'll be fun.	Ну ж бо, Томе, буде весело.
116757	I don't even vote.	Я навіть не голосую.
52015	All the students here must study French.	Всі студенти тут повинні вчити Французьку.
89605	The last mass lynching in America occurred in 1946.	Останній раз масове лінчування в Америці трапилося у тисяча дев'ятсот сорок шостому році.
120136	Tom has two cars.	Том має два автомобілі.
53798	It may be a trap.	Це може бути пасткою.
912	He has strange ideas.	У нього дивні ідеї.
21445	I warned you in advance.	Я тебе завчасно попередив.
16661	If you need some money, why don't you borrow some from your mother?	Якщо тобі потрібні гроші, чому ти не позичиш в своєї матері?
138474	Tom tried to say something, but couldn't.	Том спробував що сказати, але не зміг.
19076	I didn't eat breakfast this morning.	Я не снідала сьогодні вранці.
15585	Orange juice, please.	Апельсиновий сік, будь ласка.
52548	Tom says I'm undependable.	Том каже, що на мене не можна покластися.
151393	Tom says he'll do whatever he can.	Том каже, що зробить усе, що зможе.
129425	Never play on the road.	Ніколи не грайся на дорозі.
40607	Did you tell Tom that you did it?	Ти сказав Тому, що ти це зробив?
87559	Fragments of the mirror were scattered on the floor.	Осколки дзеркала були розкидані по підлозі.
34817	I often read in bed.	Я часто читаю в ліжку.
63407	Tom is an awful driver.	Том — жахливий водій.
125199	Doing that will be hard.	Це буде складно зробити.
75443	It's not your problem.	Це не твоя проблема.
148986	I was the one who taught Tom how to do that.	Саме я навчив Тома, як це робити.
119199	Why didn't you want me to come here?	Чому ти не хотіла, щоб я сюди прийшла?
120015	Is Tom willing to do that?	Том це бажає зробити?
35799	You said that it would happen.	Ти сказав, що це трапиться.
15432	Tom is just a little younger than I am.	Том лише трохи молодший від мене.
83311	Tom says he hopes that you win.	Том каже, що він сподівається, що ти виграєш.
120508	Would you like coffee or tea?	Бажаєте кави чи чаю?
121473	Tom and Mary are both exhausted.	І Том, і Мері обоє виснажені.
55737	Why should you care what I think?	Чому вас повинно хвилювати, що я думаю?
67746	I gave a puppy to Tom.	Я подарувала Тому цуценя.
105791	Tom tripped and fell.	Том перечепився й упав.
142230	Had I arrived earlier, I could have seen Kelly.	Якби я прийшов раніше, я б побачив Келлі.
156137	I'm still the boss.	Я все ще головний.
53010	Tom said he'd be back in October.	Том сказав, що повернеться в жовтні.
93208	I think that Tom forgot his camera.	Мені здається, Том забув свій фотоапарат.
56984	We're busy right now.	У даний момент ми зайняті.
130232	We don't negotiate with terrorists.	Ми не ведемо переговорів з терористами.
129853	Tom doesn't want to talk about it.	Том не хоче про це говорити.
3379	Why does Tom hate Mary?	Чому Том ненавидить Мері?
33079	I didn't like the way Tom did that.	Мені не сподобалося те, як Том це робить.
115557	Tom said that Mary is furious.	Том сказав, що Мері розлючена.
37240	I've always respected Tom.	Я завжди поважала Тома.
16816	Help us, please.	Допоможи нам, будь ласка.
71030	Did you wash this apple?	Ти помила це яблуко?
139698	I want to be a pilot in the future.	У майбутньому я хочу стати пілотом.
137523	Surely he'll phone me tonight.	Звичайно ж, він мені зателефонує сьогодні ввечері.
39256	That's what Tom said to Mary.	Ось що Том сказав Мері.
40669	I will be very careful.	Я буду дуже обережний.
79377	I always eat well.	Я завжди добре їм.
110754	Tom got arrested for speeding.	Тома заарештували за перевищення швидкості.
44067	I've had it with Tom.	Я вже більше не можу з Томом.
148598	Tom complained about the service.	Том скаржився на сервіс.
61882	All three of the boys wanted to do that.	Всі троє хотіли це зробити.
35081	I've finally gotten used to living here in Boston.	Я, нарешті, звик до життя тут, у Бостоні.
19232	Tom asked me to find Mary.	Том попросив мене знайти Мері.
67342	I must buy some milk.	Я маю купити молока.
92492	We now know that Tom was lying.	Тепер ми знаємо, що Том брехав.
37462	We believe you, Tom.	Ми вам віримо, Томе.
144278	Tom said he didn't speak French.	Том сказав, що не говорить французькою.
121090	I hope you didn't put sugar in my coffee.	Сподіваюся, ти не клала цукор мені до кави.
67275	Tom is very good at playing the piano.	Том дуже добре грає на піаніно.
126084	That strategy hasn't worked.	Ця стратегія не спрацювала.
17483	Tom was surprised by Mary's candor.	Відвертість Мері здивувала Тома.
56497	You're a bit shorter than I am.	Ви трохи нижча від мене.
9523	He is angry with me.	Він на мене сердитий.
10401	Many families eat dinner while watching TV.	Багато сімей вечеряють перед телевізором.
1389	I won't tell anyone about what happened.	Я нікому не скажу, що сталося.
52752	I made several mistakes.	Я зробив кілька помилок.
86327	Give me just a little.	Дайте мені зовсім трошки.
26098	We lost all of our money.	Ми втратили всі гроші.
152228	Tom said that he was very unlikely to win.	Том сказав, що дуже малоймовірно, що він виграє.
