	eng	ukr
18641	You must help her.	Ти маєш їй допомогти.
96497	I think we need to be very careful not to hurt Tom's feelings.	Я думаю, що нам потрібно бути дуже обережним, щоб не зачепити почуття Тома.
31001	The road parallels the river.	Дорога йде паралельно до річки.
47847	I'm getting used to eating alone.	Я починаю звикати їсти на самоті.
32155	I left my dictionary downstairs.	Я лишив свій словник внизу.
98493	They called the boy Tom.	Вони назвали хлопчика Томом.
7102	I thought everybody here liked Tom.	Мені здавалося, що Том усім тут подобається.
143415	Well, I don't think so.	Гм, я так не вважаю.
58214	Neither Tom nor Mary was at the meeting.	На зборах не було ані Тома, ані Мері.
25614	Tom wants to follow in his father's footsteps.	Том хоче піти стопами батька.
105122	We should be paying attention.	Ми повинні бути уважними.
61397	I must have lost it.	Я, мабуть, загубила її.
27056	Why are we running?	Для чого ми бігаємо?
82956	They waited for him for hours.	Вони годинами чекали на нього.
102327	We met in Europe a few years ago.	Ми зустрічалися в Європі кілька років тому.
120535	I accompanied her on a walk.	Я супроводжувала її під час прогулянки.
35698	I actually really like it.	Мені це дуже подобається, насправді.
60869	We have many things in common.	У нас багато чого спільного.
91951	I enjoyed the movie.	Цей фільм мені сподобався.
26551	I didn't want it to happen.	Я не бажав, щоб так трапилось.
139139	Tom says that you're still hungry.	Том каже, ти все ще хочеш їсти.
43314	How many pills did you take?	Скільки ти випила таблеток?
102517	What else do you want?	Чого ще тобі треба?
146502	Please leave Tom alone.	Залиш Тома у спокої, будь ласка.
72335	I think that Tom will go to Boston next summer.	Гадаю, наступного літа Том поїде до Бостона.
24479	Tom said Mary would call.	Том сказав, що Мері зателефонує.
84359	Why does Tom hate you so much?	Чому Том так тебе ненавидить?
133624	I don't want to go to jail.	Я не хочу до в'язниці.
109562	Today's my first day.	Сьогодні мій перший день.
122962	You're very good to me.	Ви дуже добре до мене ставитеся.
40453	I want you back in one piece.	Я хочу, щоб ти повернулася цілою та неушкодженою.
147591	Could you get a ticket for me?	Могли би ви купити мені квиток?
124090	I want to watch you suffer.	Я хочу побачити, як ти сраждаєш.
124085	I'd love to spend Christmas with you.	Я б дуже хотіла провести Різдво з вами.
114165	I don't care what Tom wants to do.	Мені байдуже, що хоче робити Том.
37238	I thought Tom had red hair.	Я думав, що Том рудий.
87946	We help each other.	Ми допомогаємо одне одному.
61960	How did you know I used to live in Australia?	Звідки ви знали, що я колись жив у Австралії?
97064	I don't want to get into the water.	Я не хочу лізти у воду.
8049	He bowed to me as he passed by.	Проходячи повз, він кивнув мені.
105964	He gave me a good piece of advice.	Він дав мені добру пораду.
33467	I'm very grateful for your help.	Я вам дуже вдячна за допомогу.
31271	Why don't you come over for dinner?	Чому б вам не зайти на вечерю?
28478	She gave birth to a daughter yesterday.	Вона вчора народила доньку.
72031	This book is Tom's.	Ця книжка належить Тому.
99000	Tom said that Mary was ugly.	Том сказав, що Мері негарна.
40111	I asked him not to bother me.	Я попросила його не заважати.
153515	That child has few friends.	У тієї дитини є декілька друзів.
134980	He will be waiting for you.	Він чекатиме на тебе.
21578	What're you doing today?	Чим ви сьогодні будете займатися?
62426	Tom is taller than his mother.	Том вищий, ніж його матір.
1227	Tom's room wasn't clean.	У кімнаті Тома не було прибрано.
97914	I think my mom knows.	Мені здається, мама знає.
188	I'm sure Tom wasn't surprised.	Я певен, що Том не був здивований.
86338	You have such beautiful eyes.	У вас такі гарні очі.
114476	Is it OK with you if I do that?	Ви не проти, якщо я це зроблю?
96103	What do you have for breakfast?	Що маєш на сніданок?
38742	Tom drove his children to football practice.	Том відвіз дітей на футбольне заняття.
71360	We all thought you were married.	Ми всі думали, що ти заміжній.
97374	Don't rule it out completely.	Не виключайте цього повністю.
2006	Tom told me he's last.	Том сказав мені, що він останній.
87845	Tom told Mary what she had to buy.	Том сказав Мері, що їй потрібно купити.
155037	We still have to be very careful.	Ми все ще маємо бути обережні.
16469	How can I get there?	Як я можу туди дістатися?
98964	We're still open.	Ми все ще працюємо.
82235	I have no doubt about that.	Я не маю сумнівів щодо цього.
86554	I had dinner with Tom.	Я повечеряв з Томом.
37697	We're not going there.	Ми туди не поїдемо.
107796	He ran across the street, leaving her alone.	Він перебіг через вулицю, лишивши її саму.
117035	It's a good thing you did that.	Добре, що ти це зробив.
50661	I'm not the one who ate all the cookies.	Це не я з'їв усе печиво.
78353	I would act differently in your place.	На вашому місці я би поступив інакше.
135455	That would be interesting.	Це було би цікаво.
93439	I wonder if I can do that again.	Я питаю себе, чи я зможу це зробити ще раз.
110197	What's Tom going to do for Mary?	Що зробить Том для Мері?
48365	He's married to an American woman.	Він одружений на американці.
52494	Tom is hoping that happens.	Том сподівається, що це станеться.
122110	We avoid talking about politics.	Ми уникаємо розмов про політику.
20545	I like your family.	Мені подобається твоя родина.
93124	I have a wonderful teacher.	У мене чудовий вчитель.
99736	Reptiles are cold-blooded.	Плазуни — холоднокровні тварини.
115185	Tom told me that he didn't intend to do that.	Том сказав мені, що він не має наміру робити цього.
15509	We don't sell what you're looking for.	Ми не продаємо того, що ви шукаєте.
144104	I've promised Tom that I would help.	Я пообіцяв Тому, що допоможу.
37683	You may kiss me if you like.	Можеш поцілувати мене, якщо хочеш.
7902	Tom is becoming a problem.	Том починає ставати проблемою.
140751	How did you persuade Tom to do that?	Як ти переконала Тома це зробити?
55865	I asked him to drive me home.	Я попросив його відвезти мене додому.
120406	If you didn't do that, who did?	Якщо це зробив не ти, то хто?
88886	You have a very pretty name.	У вас дуже гарне ім'я.
114634	Tom should be in the hospital.	Тому слід бути в лікарні.
104242	This is your hat, isn't it?	Це твоя шапка, еге ж?
23203	She takes everything for granted.	Вона все приймає за належне.
93329	Watch how I do it.	Дивіться, як я це роблю.
28947	Have you ever seen a UFO?	Ти колись бачила НЛО?
63822	You'd like it.	Це тобі сподобалося би.
43281	They're playing a game.	Вони грають у гру.
106222	Have you always lived here?	Ти завжди тут жив?
33029	Tom didn't know who to ask.	Том не знав, кого запитати.
122871	Do you think that fish can hear?	Гадаєш, риби чують?
147267	Tom knows I'm older than him.	Том знає, що я від нього старший.
4107	I like your dogs.	Мені подобаються твої собаки.
12466	I think Tom lied to us.	Думаю, Том нам збрехав.
136323	Did you just figure that out?	Ти щойно це зрозумів?
80073	I love to skate.	Я люблю кататися на ковзанах.
40233	I'll show you the way to the station.	Я покажу тобі дорогу на станцію.
134365	Should we try to help?	Нам слід спробувати допомогти?
6591	Can you call him?	Ти можеш його покликати?
77161	Tom needs your help more than I do.	Тому ваша допомога потрібна більше, ніж мені.
94587	Tom came up with an ingenious idea.	Тому прийшла в голову геніальна ідея.
116006	I think I'll turn in.	Гадаю, мені час спати.
43608	I think that Tom is a CPA.	Я думаю, що Том — бугхалтер.
120570	Why can't you go to Australia?	Чому ви не можете поїхати до Австралії?
100668	Don't you think we need this?	Ти не вважаєш, що нам це потрібно?
127082	Can I use your telephone?	Можна скористатися вашим телефоном?
46611	Tom used to hate Mary.	Том колись ненавидів Мері.
23266	We'll never do that.	Ми ніколи цього не робимо.
121460	Will we be in time for the concert?	Ми встигнемо на концерт?
56968	Tom is a school bus driver.	Том — водій шкільного автобуса.
106410	You are as white as a sheet.	Ви білі як смерть.
131317	Why are you reading this?	Нащо ти це читаєш?
113922	Tom said that he was drunk.	Том сказав, що він п'яний.
21409	I know that Tom didn't do that correctly.	Я знаю, що Том це неправильно зробив.
113591	What do you believe in?	У що ти віриш?
94415	Tom vowed he'd never do that.	Том поклявся, що нікого цього не робитиме.
116924	You arrived just in time.	Ти прибув як раз вчасно.
121854	Tom's car is in the garage.	Машина Тома в гаражі.
135156	I don't ever want to see you again.	Я не хочу тебе більше бачити.
80768	I wonder whether I should do that or not.	Я питаю себе, чи слід мені це зробити.
13604	Can Tom really swim faster than you?	Том насправді може плисти швидше, ніж ви?
4619	Surprisingly, I agree with Tom.	Як це не дивно, я згодна з Томом.
79097	Do you have anything for a headache?	Ви маєте щось від головного болю?
152110	Kyoto was the former capital of Japan.	Кіото — колишня столиця Японії.
155832	Is that good or bad for Tom?	Це добре чи погано для Тома?
5061	I know that I'm crazy.	Я знаю, що я схиблений.
125707	It's hard to get rid of bad habits.	Важко позбавитися поганих звичок.
135530	Tom swims as fast as Mary does.	Том плаває так само швидко, як і Мері.
47823	Tom doesn't know anyone who is able to do that.	Том не знає нікого, хто може це зробити.
34670	I want you to be with me.	Я хочу, щоб ви були зі мною.
41651	Tom was the last to find out about it.	Том дізнався про це останнім.
32577	Did you take Tom's advice?	Ви скористалися порадою Тома?
106094	Tom raised three children all by himself.	Том сам виховав трьох дітей.
76504	Tom is so mean to you.	Том такий недобрий по відношенню до тебе.
102123	I got up earlier than usual.	Я встала раніше, ніж звичайно.
70185	Why do you want Tom to do that?	Чому ви хочете, щоб Том це зробив?
49914	We might go to Australia next spring.	Наступної весни ми, можливо, поїдемо до Австралії.
18271	I'd advise you to not eat that.	Я би порадив вам не їсти м'яса.
68953	Did Tom come to Boston with you?	Том приїхав до Бостона разом із тобою?
65384	The doll lay on the floor.	Лялька лежить на підлозі.
64492	I knew that I could beat Tom.	Я знав, що можу перемогти Тома.
84478	I didn't know that Tom knew how to do that.	Я не знала, що Том знає, як це зробити.
67386	I don't want Tom to worry.	Я не хочу, щоб Том хвилювався.
45713	Tom said that he probably wouldn't cry.	Том сказав, що він, мабуть, не заплаче.
15193	Tom poured some milk in a bowl for his cats.	Том налив трохи молока в миску для своїх котів.
102503	Tom wants Mary to be careful.	Том хоче, щоб Мері була обережна.
100961	All the names are listed in alphabetical order.	Усі прізвища розміщені в алфавітному порядку.
128660	I've got a boat.	У мене є човен.
39785	I never said I wanted to go with you.	Я ніколи не казала, що хочу поїхати з вами.
28307	Everyone should exercise their right to vote.	Кожний має скористатися правом голосу.
93757	Are you certain about this?	Ти щодо цього впевнений?
74965	How many apples do you want?	Скільки ви хочете яблук?
38183	I was already married at your age.	У вашому віці я вже була у шлюбі.
147930	No one will hurt you.	Ніхто вам не зробить болісно.
22671	I like red wine better than white wine.	Я люблю більше червоне вино, а не біле.
89149	I've always loved elephants.	Я завжди обожнювала слонів.
155685	Was I really boring?	Я й насправді був нудний?
33463	I was with Tom last week.	Минулого тижня я був із Томом.
128654	Thanks for driving me here.	Дякую, що довіз мене сюди.
65014	Aren't you almost ready?	Хіба ти майже не готова?
83162	I thought Tom wouldn't win.	Я думав, Том не виграє.
87006	Tom showed me some pictures.	Том показав мені кілька фотографій.
88965	Tom knows who did this.	Том знає, хто це зробив.
74710	How well do you know French?	Наскільки добре ти знаєш французьку?
141277	This restaurant is open 24/7.	Цей ресторан працює цілодобово.
18786	Bring me the newspaper, please.	Принесіть мені газету, будь ласка.
94802	I understand your anger.	Я розумію твій гнів.
6859	Tom called while you were in the shower.	Том телефонував, коли ви приймали душ.
111142	Tom didn't want to help.	Том не хотів допомагати.
151189	Mary is more beautiful than Alice.	Мері гарніша за Алісу.
67390	Where does your grandmother live?	Де живе твоя бабуся?
122382	You're in grave danger.	Ти у серйозній небезпеці.
47759	I wasn't following the conversation.	Я не слідкував за розмовою.
23052	I think that Tom will probably remember you.	Гадаю, що Том, мабуть, тебе пам'ятатиме.
90764	Tom hasn't been contacted yet.	З Томом ще не зв'язалися.
69530	How much more time do we have?	Скільки в нас є ще часу?
29551	Tom often dreams of his girlfriend.	Том часто мріє про свою дівчину.
47774	What Tom told me helped me a lot.	Те, що мені сказав Том, мені дуже допомогло.
64262	I saw what your dog did.	Я бачила, що зробив ваш собака.
24000	It looks like Tom won't help us.	Здається, Том нам не допоможе.
47553	I didn't think Tom would like Mary.	Я не думала, що Мері сподобається Тому.
35366	That's my favorite part.	Це моя улюблена частина.
104606	I'm afraid I took the wrong train.	Боюся, я сів не в той потяг.
133693	Tom died without heirs.	Том помер, не лишивши спадкоємців.
68476	What happened was out of my control.	Те, що трапилось, було поза моїм контролем.
124101	I want to buy a purple sweater.	Я хочу купити фіолетовий светр.
153218	You did your best.	Ти зробив усе, що міг.
8260	I want to feel important.	Я хочу відчувати себе важливою.
102138	It's hard to believe.	Важко в це повірити.
3812	We were very sad.	Нам було дуже сумно.
49293	Can anyone guess what this is?	Хтось може вгадати, що це таке?
73979	Are you implying something?	Ти на щось натякаєш?
1298	What's the name of this river?	Як називається ця річка?
143040	I bought a new car.	Я купив нову машину.
145085	Tom earns twice as much as I do.	Том заробляє вдвічі більше від мене.
72376	Do you know how to play checkers?	Ти вмієш грати у шашки?
62359	Why did you lie to me?	Чому ви сказали мені неправду?
112225	Tom said he hopes that you like doing that.	Том сказав, що він сподівається, що тобі подобається цим займатися.
98370	I saw Tom with Mary.	Я бачив Тома з Мері.
108594	I believe Tom is innocent.	Я думаю, що Том невинний.
2502	I didn't want to help.	Я не хотів допомогати.
31586	Tom isn't afraid to do anything.	Том нічого не боїться робити.
75902	I know you're not wrong.	Я знаю, що ви не помиляєтеся.
68889	Tom said Mary is very happy.	Том сказав, що Мері дуже щаслива.
60163	I always speak French with Tom.	Я завжди говорю французькою з Томом.
11382	At first, I was disappointed.	Спочатку я був розчарований.
1368	I expect a lot from him.	Я багато чого від нього очікую.
134510	Mary's dress is too long.	У Мері задовга сукня.
148480	I must buy groceries.	Я повинен купити продукти.
104993	I'm sick and tired of hamburgers.	Я до смерті втомилася від гамбургерів.
2918	I'll be there to help you.	Я там буду, щоб вам допомогти.
144034	Tom asked Mary to drive John to the airport.	Том попросив Мері підвезти Джона до аеропорту.
59971	I'm going to go to Boston.	Я поїду до Бостона.
31369	Tom and Mary are dancing.	Том та Мері танцюють.
54881	I'd like you to translate this document into French.	Я хотів би перекласти цей документ на французьку.
82276	Would you like to dance with me?	Ти не хотіла би зі мною потанцювати?
20987	I think that I asked the right questions.	Гадаю, я поставила добрі запитання.
80193	Tom is an opera lover.	Том — цінувальник опери.
100327	Tom doesn't smile very often.	Том не посміхається дуже часто.
126692	Tom has told me a lot about you.	Том багато чого мені про тебе розповів.
9771	I wonder who'll do that tomorrow.	Цікаво, хто цим завтра займатиметься.
21524	Tom didn't know who Mary's husband was.	Том не знав, хто чоловік Мері.
130852	Please write it down.	Будь ласка, запишіть це.
113619	We were all running short of money then.	Нам усім тоді не вистачало грошей.
82693	You could've done that yesterday.	Том міг би це зробити вчора.
108239	I know that Tom lied to me.	Я знаю, що Том мені збрехав.
109176	I didn't think Tom would be so mad.	Я не думала, що Том буде такий злий.
152150	I plan to give my son a computer at the end of the month.	Я планую в кінці місяця подарувати сину комп'ютер.
144654	Why don't we do that right now?	Чому б нам не зробити цього просто зараз?
56835	I don't want to be like that.	Я не хочу таким бути.
52860	Those horses are mine.	Ці коні — мої.
107975	I don't have a bicycle.	Я не маю велосипеда.
91646	Perhaps I can be of help.	Може бути, я можу допомогти.
126029	Tom wants you to help him today.	Том хоче, щоб ви сьогодні йому допомогли.
146094	Tom said he thought that Mary wasn't hungry.	Том сказав, що, на його думку, Мері не голодна.
71540	I thought it wasn't necessary to do that.	Я думала, що було необхідно це зробити.
50568	Mary is a very good-looking woman.	Мері дуже приваблива жінка.
71900	Cross Tom's name off the list.	Викресліть ім'я Тома зі списку.
130058	Tom didn't intend to do that.	Том не мав наміру цього робити.
120295	What does Tom know about this?	Що Том про це знає?
45605	We have to reduce the cost to a minimum.	Ми повинні зменшити затрати до мінімального рівня.
59450	Why does Tom want to do that anyway?	Чому Том хоче це зробити у будь-якому випадку?
66847	I'm sure Tom will be confused.	Я певен, що Том буде спантеличений.
53286	We've done what we could.	Ми зробили, що змогли.
99643	You're the very person I've been looking for.	Ти саме та, кого я шукав.
58563	How did you spend the money I gave you?	Як ви витратили гроші, які я тобі дав?
32117	I really appreciate your coming.	Я дуже ціную, що ти прийшла.
39303	You can't do that anymore.	Ти більше не можеш цього робити.
115352	You look pretty young.	Ти виглядаєш доволі молодою.
77701	Thanks for your quick answer.	Дякую за швидку відповідь.
45878	I got back at 2:30.	Я повернувся о другій тридцять.
78662	Everybody seems to like Tom.	Видається, що Том подобається всім.
103260	Can I sit next to you?	Можна мені сісти поруч?
100687	You've read the report, haven't you?	Ти ж прочитав звіт?
149892	Tom went to the beach with Mary last weekend.	На минулих вихідних Том з Мері ходили на пляж.
17714	Tom and Mary live in Australia.	Том та Мері живуть у Австралії.
43159	Tom saw Mary working.	Том бачив, як Мері працює.
28998	I can't bear the pain.	Я не можу терпіти цього болю.
54711	Tom ironed his shirt.	Том випрасував свою сорочку.
83937	I wouldn't celebrate just yet.	Я би поки що не святкував.
3213	The boy lost his way in the forest.	Хлопець заблукав у лісі.
117537	I'm dying for frozen yogurt.	Вмираю, так хочу мороженого йогурта.
65116	Tom is Mary's son.	Том — син Мері.
44051	Please don't leave valuable things here.	Будь ласка, не залишайте тут цінних речей.
131069	Tom knows why Mary laughed.	Том знає, чому Мері засміялася.
35051	Tom lasted less than a month on the job.	Том протримався на роботі менше місяця.
27237	Tom said that he'd never let you drive.	Том сказав, що ніколи не дозволить вам сісти за кермо.
149129	I think that Tom is too young to retire.	Мені здається, Том замолодий для того, щоб іти на пенсію.
60522	I will come to your country some day.	Я колись приїду у твою країну.
