	eng	pol
46097	I have known her since she was a baby.	Znam ją, odkąd była niemowlakiem.
14989	I'm not sure I share your optimism.	Nie jestem pewien, czy podzielam twój optymizm.
10545	There's no need to be insulting.	Nie trzeba być obraźliwym.
4677	You've made me the happiest man in the world.	Uczyniłaś mnie najszczęśliwszym mężczyzną na świecie.
40658	He drank a cup of tea and then asked for another.	Wypił filiżankę herbaty i zaraz potem poprosił o następną.
44066	I want you to tell me the truth.	Chcę, żebyś powiedział mi prawdę.
42729	Do I have any other choice?	Czy mam jakiś inny wybór?
43159	It was a pleasure working with you folks.	Współpraca z wami to była czysta przyjemność.
22109	I'm talking about my friend.	Mówię o moim przyjacielu.
1333	As a vegetarian, she doesn't eat meat.	Jako wegetarianka, nie je mięsa.
37459	There are too many people on this bus.	Jest zbyt wielu ludzi w tym autobusie.
25776	I asked Tom to lend me some money.	Poprosiłem Toma, aby pożyczył mi pieniądze.
6058	I gave Tom all the money I had on me.	Dałem Tomowi wszystkie pieniądze, które miałem przy sobie.
7285	This is the book Tom and I were talking about.	To jest ta książka, o której rozmawialiśmy z Tomem.
18992	I don't want to marry Mary.	Nie chcę żenić się z Mary.
2255	Can you tell me how to fill in this form?	Mógłbyś powiedzieć mi jak wypełnić ten formularz?
29321	Why do you want to borrow my knife?	Dlaczego chcesz pożyczyć mój nóż?
825	Give me your opinion, please.	Chciałbym usłyszeć twoje zdanie.
9111	It's not there.	Nie ma tam tego.
11564	It's often said the best way to learn a foreign language is to learn from a native speaker.	Często mówi się, że najlepszą metodą nauki języka jest nauka z rodzimym jego użytkownikiem.
1470	Has anyone seen it yet?	Czy ktoś już to widział?
6083	I've done nothing interesting today.	Nie zrobiłem dzisiaj nic interesującego.
7917	Why on earth would I do that?	Po jakiego grzyba miałbym to robić?
13475	When I awoke, it was snowing.	Kiedy się obudziłem, padał śnieg.
41165	It's more difficult than you think.	To jest trudniejsze niż myślisz.
22889	The law is still in effect.	Ten przepis wciąż obowiązuje.
8807	Look at that handsome boy.	Spójrz na tego przystojnego chłopca.
10070	I'm well aware of the situation.	Jestem w pełni świadom sytuacji.
6396	Don't judge others by the color of their skin.	Nie osądzaj innych po kolorze skóry.
38567	Why are you pretending you can't understand French?	Czemu udajesz, że nie możesz zrozumieć francuskiego?
26585	Are you going to go anywhere this summer?	Czy idziesz gdziekolwiek tego lata?
31490	Who does this suitcase belong to?	Do kogo należy ta walizka?
16935	He only listens to rock bands from the fifties.	On słucha wyłącznie zespołów rockowych z lat pięćdziesiątych.
40310	Something you should know about me is that my greatest fear in life is that people will find out that I'm poor.	Trzeba ci wiedzieć, że moją największą obawą w życiu jest to, że ludzie zorientują się, że jestem ubogi.
40472	She has an uncle who works in a bank.	Ona ma wujka, który pracuje w banku.
17571	Tom didn't want to believe me.	Tom nie chciał mi wierzyć.
14901	Take this medicine twice a day.	Zażywaj ten lek dwa razy dziennie.
18995	The world needs talented people.	Świat potrzebuje zdolnych ludzi.
36406	I wasn't aware that you were feeling so bad.	Nie wiedziałem, że czujesz się tak źle.
5985	I wouldn't like to work in a hospital.	Nie chciałabym pracować w szpitalu.
46044	"The policeman aimed his gun at Tom and yelled, ""Hold it right there!"""	"Policjant wycelował broń w kierunku Toma i krzyknął ""Nie ruszaj się!""."
15047	My grandfather predeceased my great-grandfather.	Mój pradziadek przeżył mojego dziadka.
28112	Why do you have so many cats?	Dlaczego macie tak dużo kotów?
10706	I don't think that Tom would be doing that if he didn't want to.	Nie wydaje mi się, żeby Tom zamierzał to robić, gdy nie miał ochoty.
32522	Yes. That's right.	Tak. To prawda.
9805	Tom comes here every single day.	Tom przychodzi tutaj każdego dnia.
25018	After school, Tom usually sticks around as long as he can because he doesn't want to go home.	Po szkole Tom zazwyczaj snuje się tak długo, jak tylko może, ponieważ nie chce iść do domu.
24467	I'm going to try real hard to be nice to Tom.	Bardzo się postaram być miły dla Toma.
13375	It's not a gimmick.	To nie jest sztuczka.
39821	Plants die without water.	Rośliny umierają bez wody.
20366	Is your gun loaded?	Czy twoja broń jest naładowana?
18323	I wish that Tom would leave.	Chciałbym, żeby Tom sobie poszedł.
22021	You're in the right place.	Jesteś w dobrym miejscu.
15478	Keep your eyes closed until I tell you to open them.	Miej oczy zamknięte, dopóki nie powiem ci, żebyś je otworzył.
7559	One is new, and the other is old.	Jeden jest nowy, a drugi stary.
39103	The question is who's going to go first.	Pytanie, kto pójdzie pierwszy.
11255	There's a book about dancing on the desk.	Na biurku jest książka o tańcu.
38736	I was just wondering how much it would cost to have my car washed and waxed.	Ciekawe, ile by kosztowało umycie i nawoskowanie mojego samochodu.
10096	I don't want to lose you again.	Nie chcę cię znów stracić.
11755	You can't blame me for that.	Nie możesz mnie za to winić.
9448	Is this what you've been searching for all this time?	Tego szukałeś cały czas?
7422	How often do you go fishing?	Jak często chodzisz na ryby?
14596	It looks like Tom was wrong.	Wygląda na to, że Tom nie miał racji.
15994	Tom just wrote a book.	Tom właśnie napisał książkę.
45436	Tom does only what he wants to do.	Tom robi tylko to, co chce.
39355	I shouldn't have drunk that last bottle of beer.	Nie powinienem był pić tej ostatniej butelki piwa.
22842	Hatred is our enemy.	Nienawiść jest naszym wrogiem.
43711	I learned from the best.	Uczyłem się od najlepszych.
23558	I wonder who it was.	Zastanawiam się, kto to był.
44027	My mother took my temperature.	Moja matka zmierzyła mi temperaturę.
5488	Let's call it a day.	Na dziś już kończymy.
6559	I don't know whether to laugh or cry.	Nie wiem czy się śmiać czy płakać.
4688	Have you finished breakfast yet?	Czy już skończyłeś śniadanie?
13127	Have you shown Tom your wedding pictures?	Pokazywaliście Tomowi swoje zdjęcia ze ślubu?
45274	Is this a drill?	Czy to są ćwiczenia?
37744	Tom dropped his glass.	Tom upuścił swoją szklankę.
9668	Most people won't notice that.	Większość ludzi tego nie zauważy.
22123	Who was Tom afraid of?	Kogo bał się Tom?
24761	Tom doesn't like drinking coffee out of a paper cup.	Tom nie lubi pić kawy z papierowego kubka.
6980	How's the water here?	Jaka tu jest woda?
22159	Which European city do you like the most?	Które europejskie miasto najbardziej lubisz?
8100	How many other people know about this?	Ilu jeszcze ludzi o tym wie?
9078	We have a reservation for six-thirty.	Mamy rezerwację na szóstą trzydzieści.
40456	The movie received mixed reviews.	Ten film zebrał mieszane recenzje.
13576	I like geography and history.	Lubię geografię i historię.
21382	She made many mistakes in typing the report.	Ona zrobiła wiele błędów, pisząc to sprawozdanie.
20566	Our visit was wonderful.	Nasza wizyta była wspaniała.
4706	I slept just two hours.	Spałam tylko dwie godziny.
13691	I haven't been feeling well for the past few days.	Już od kilku dni nie najlepiej się czuję.
40030	Musicians are usually sensitive to criticism.	Muzycy są zwykle wrażliwi na krytycyzm.
13184	It isn't just a question of price.	To nie jest kwestia tylko ceny.
19950	Tom and Mary are thinking about starting a family.	Tom i Mary myślą o założeniu rodziny.
30154	I'm investing in my future.	Inwestuję w swoją przyszłość.
28836	Tom doesn't believe in astrology.	Tom nie wierzy w astrologię.
12075	It's cold outside.	Na zewnątrz jest zimno.
21262	Not every question deserves an answer.	Nie każde pytanie zasługuje na odpowiedź.
30456	I lived in Boston until I was thirteen.	Mieszkałem w Bostonie do trzynastego roku życia.
43220	I'm sorry, but I have to go to the gym.	Przepraszam, muszę iść na siłownię.
21996	I think Tom will be angry.	Myślę, że tom będzie zły.
28441	That's the stupidest thing I've ever said.	To najgłupsza rzecz, jaką kiedykolwiek powiedziałem.
2037	What's the ambassador's name?	Jak ma na imię ambasador?
4222	Why on earth would I do that?	Jak u diabła miałabym to zrobić?
31793	I didn't see anyone in the park except Tom.	Nie widzę w parku nikogo oprócz Toma.
41879	It wasn't expensive.	To nie było drogie.
13042	They attempted in vain to bribe the witness.	Na próżno próbowali przekupić świadka.
42716	Can we do it this week?	Możemy zrobić to w tym tygodniu?
21091	I've visited Boston a few times.	Zwiedziłem Boston już kilka razy.
34547	I went straight home.	Poszedłem prosto do domu.
1560	The old man is wise and knows many things about life.	Starzec jest mądry i wie dużo o życiu.
29085	Tom's phone was confiscated by the teacher.	Telefon Toma został skonfiskowany przez nauczyciela.
25300	I'm surprised that I don't have to do the same thing you have to do.	Dziwi mnie, że nie muszę robić tego samego, co ty.
25098	Do you want to drink coffee?	Chcesz napić się kawy?
42409	Tom decided not to go to college.	Tom postanowił nie iść do college'u.
8801	I won't plead guilty.	Nie przyznam się do winy.
17953	We're going to eat a lot tonight so I hope you're not on a diet.	Będziemy dziś dużo jeść, więc mam nadzieję, że nie jesteś na diecie.
5490	He must finish his homework today.	Musi dzisiaj dokończyć pracę domową.
22523	I couldn't get the point of his speech.	Nie złapałem, o co chodziło w jego wystąpieniu.
45763	I want to hear about what happened.	Chcę usłyszeć, co się stało.
46069	Tom arrived at work late.	Tom spóźnił się do pracy.
22673	I remember seeing you last year.	Pamiętam, jak Cię widziałem w ubiegłym roku.
16011	I don't want to be here.	Nie chcę tu być.
43661	Is there intelligent life on other planets?	Czy istnieje inteligentne życie na innych planetach?
31803	Only sixteen percent of the teachers at this school are women.	Tylko szesnaście procent nauczycieli w tej szkole to kobiety.
42125	Tom is very busy now.	Tomek jest teraz bardzo zajęty.
5590	Tom is never going to let you go to Boston with Mary.	Tom nigdy nie pozwoli ci pojechać do Bostonu z Mary.
6912	I'm ready to start.	Jestem gotów by zacząć.
20361	She always writes down every word her teacher says.	Ona zawsze zapisuje każde słowo swego nauczyciela.
7861	He works in the car industry.	Pracuje w przemyśle samochodowym.
44952	We were just kidding around.	Po prostu się wygłupialiśmy.
40599	He's a bit shy.	On jest trochę nieśmiały.
6723	There is no other choice.	Nie ma innego wyjścia.
8169	Fasten your seat belt, please.	Proszę, zapnij swój pas.
25224	Tom turned on the table lamp.	Tom włączył lampę na stole.
15067	Could I use your phone?	Czy mógłbym skorzystać z telefonu?
7592	What exactly do you mean?	O co ci konkretnie chodzi?
20972	They're the only ones Tom can trust.	Są jedynymi, którym Tom może zaufać.
12227	Has the bell rung yet?	Czy dzwon już dzwonił?
27359	She's been ill since last Wednesday.	Jest chora od ostatniej środy.
32363	If there's anything I can do to help, please let me know.	Jeśli jest coś, co mogę zrobić, żeby pomóc, daj mi znać.
1825	This guitar is so expensive that I can't afford to buy it.	Ta gitara jest tak droga, że nie stać mnie na jej kupno.
30388	I couldn't believe it when they told me.	Nie mogłem w to uwierzyć, kiedy mi o tym powiedzieli.
6609	Tom explained the circumstances to Mary.	Tom wytłumaczył Mary okoliczności.
35885	Tom speaks French as well as me.	Tom mówi po francusku tak dobrze, jak ja.
10787	Canada borders the United States.	Kanada graniczy ze Stanami Zjednoczonymi.
33612	We should call Tom and see if he needs any help.	Powinniśmy zadzwonić do Toma i sprawdzić, czy nie potrzebuje pomocy.
27274	I had difficulty getting a ticket for the concert.	Z trudem zdobyłem bilet na koncert.
10655	He's proud of never being late to school.	On jest dumny z tego, że nigdy nie spóźnia się do szkoły.
43108	Tom got bored and left.	Tom się znudził i wyszedł.
3894	Have you said anything to Tom?	Czy powiedziałeś cokolwiek do Toma?
11725	Don't you just love it?	Czyż to nie jest słodkie?
31387	We'll give an interview in the afternoon.	Damy wywiad po południu.
37961	I don't speak French.	Nie mówię po francusku.
36569	Tom and I had a fight.	Pobiliśmy się z Tomem.
44600	She's eating for two.	Ona je za dwóch.
38180	I'm getting stronger every day.	Staję się silniejszy każdego dnia.
20671	My book has to be somewhere in the room.	Moja książka musi być gdzieś w pokoju.
23951	It could take a couple of days.	To może zająć kilka dni.
13543	I thought that you were a man of honor.	Myślałem, że jesteś człowiekiem honoru.
12208	I don't want to wait that long.	Nie chcę czekać aż tak długo.
41780	I have to find out who killed Tom.	Muszę się dowiedzieć, kto zabił Toma.
26217	Some people say that you shouldn't check your email first thing in the morning.	Są tacy, co twierdzą, że nie powinno się zaczynać dnia od sprawdzania e-maila.
33778	I have a meeting with Tom today.	Mam dziś spotkanie z Tomem.
16929	Pretend you're me.	Udawaj, że jesteś mną.
17556	I'm not sure how it happened.	Nie jestem pewien jak to się stało.
9476	Three is my lucky number.	Trzy to moja szczęśliwa liczba.
41532	I'd have succeeded if I'd tried harder.	Udałoby mi się gdybym się bardziej postarał.
23664	The more one has, the more one wants.	Im więcej ma, tym więcej chce.
14753	I'm beginning to think that I shouldn't have enlisted in the army.	Zaczynam myśleć, że nie powinienem był zaciągać się do wojska.
28367	That's not fair, is it?	To niesprawiedliwe, prawda?
21909	Tom wasn't able to contact Mary by phone.	Tom nie mógł się skontaktować telefonicznie z Mary.
7100	It could be heroin.	To może być heroina.
21693	I have to go and see what Tom wants.	Muszę iść i się dowiedzieć, czego chce Tom.
35203	Where are my glasses?	Gdzie są moje okulary?
36358	There are many wild animals in this area.	Te tereny obfitują w dziką zwierzynę.
15995	Lake Biwa could be seen from where we were standing.	Z miejsca, gdzie staliśmy, widać było jezioro Biwa.
97	She is leaving for America tonight.	Ona wyjeżdża dzisiaj w nocy do Ameryki.
22720	Tom never missed a day of work.	Tom nigdy nie opuścił dnia pracy.
24551	Which do you like better, the Giants or the Dragons?	Kogo wolisz: Olbrzymów czy Smoki?
41271	When was the first time you met her?	Kiedy spotkałeś ją po raz pierwszy?
15005	Tom is often late for school on Mondays.	Tom często spóźnia się do szkoły w poniedziałki.
4786	We'll miss you when you're not here.	Będzie nam cię brakowało kiedy cię tu nie będzie.
24593	Go to your spot.	Idź na swoje miejsce.
31747	I think I have something you want.	Chyba mam coś, czego chcesz.
7090	I don't know how to play the oboe.	Nie potrafię grać na oboju.
26180	Hand me that broom.	Podaj mi tę miotłę.
35423	Tom said he was willing to lend us three thousand dollars.	Tom powiedział, że jest skłonny pożyczyć nam trzy tysiące dolarów.
12210	Could you please look the other way while I change my clothes?	Mógłbyś patrzeć w inną stronę, podczas gdy ja się przebiorę?
17345	You should come to Australia.	Powinieneś przyjechać do Australii.
42829	What exactly do you mean?	Co dokładnie masz na myśli?
40681	India was governed by Great Britain for many years.	Indie były rządzone przez Wielką Brytanię przez wiele lat.
7214	She didn't exactly agree with me.	Nie do końca się ze mną zgodziła.
26526	I can't see anything in here.	Niczego tu nie widzę.
36570	He cannot afford to buy a car.	On nie może sobie pozwolić na kupno samochodu.
29704	Today, I'll sleep on the couch.	Dziś będę spał na kanapie.
7854	I wasn't busy last week.	W zeszłym tygodniu nie byłem zajęty.
21767	Is Boston far away?	Czy Boston jest daleko?
34040	I've decided to leave Boston.	Postanowiłam wyjechać z Bostonu.
33438	Men's things are sold on the third floor.	Towary dla panów są w sprzedaży na trzecim piętrze.
22287	Does Tom know about it?	Czy Tom wie o tym?
12149	Burglars broke into our apartment and stole my wife's fur coat.	Złodzieje włamali nam się do mieszkania i ukradli futro mojej żony.
38035	What's your favorite home-cooked food?	Jakie jest twoje ulubione jedzenie domowej roboty?
34561	I want to eat something that's not hot and spicy.	Chcę zjeść coś, co nie jest gorące ani ostre.
19382	I don't have to worry about that anymore.	Nie chcę się o tym już więcej martwić.
26158	The problem is that Tom doesn't always do his homework.	Problem w tym, że Tom nie zawsze odrabia zadania.
22120	Tom said that he wanted to speak to the manager.	Tom powiedział, że chce mówić z menedżerem.
26741	Could you show me the way?	Czy mógłbyś pokazać mi drogę?
28330	"He said, ""I'm from Canada."""	"Powiedział: ""Jestem z Kanady."""
32726	There is no wine in that bottle.	W tej butelce nie ma wina.
6324	Tom is obviously upset with Mary's behavior.	Tom jest oczywiście zdenerwowany zachowaniem Mary.
4784	I didn't get enough sleep last night.	Nie wyspałem się dzisiaj.
21846	Tom isn't used to riding a motorcycle.	Tom nie jeździ motocyklem.
27832	Tom will be home tonight.	Tom będzie w domu tej nocy.
3127	I'm not quite sure yet.	Nie do końca jestem pewna.
6021	He'll do anything for money.	On zrobi wszystko dla pieniędzy.
42867	I'd rather go today than tomorrow.	Wolałbym pójść dzisiaj niż jutro.
8352	The sun sank below the horizon.	Słońce zaszło za horyzont.
34959	I want you to not go to Boston with Tom.	Chcę, żebyś nie jechał z Tomem do Bostonu.
44255	Strictly speaking, the tomato is a fruit.	Ściśle mówiąc, pomidor jest owocem.
15770	Tom doesn't want to work here.	Tom nie chce tutaj pracować.
35567	She wanted to get away from everyday life.	Chciała uciec od życia codziennego.
2240	I can't stand to watch you.	Nie mogę na to patrzeć.
5355	I actually enjoyed that.	Właściwie to mi się podobało.
17257	We haven't seen each other for such a long time.	Nie widzieliśmy się tak długo.
30159	Every year, I buy new notebooks for school.	Co roku kupuję nowe zeszyty do szkoły.
35324	How may I help you today, sir?	W czym mogę Panu dzisiaj pomóc?
31594	I need to clean up a bit here.	Muszę tu trochę posprzątać.
4047	You don't need one now.	Teraz tego nie potrzebujesz.
8460	I know who they are.	Wiem, kim są.
27119	She read the poem aloud.	Przeczytała wiersz na głos.
32304	You're making a big fuss about nothing.	Robisz wielki hałas o nic.
14738	What were you doing that moment?	Co robiliście w tamtej chwili?
21627	He speaks as if he knew everything.	Mówi tak, jakby wiedział wszystko.
14758	Please mail this letter for me.	Wyślij ten list, proszę.
42139	I wouldn't mind a drink.	Nie miałbym nic przeciwko wypiciu drinka.
13987	Those clocks got broken.	Te zegary zepsuły się.
33567	Did you hear all that?	Czy słyszeliście to wszystko?
11999	I will badly miss you if you leave Japan.	Będzie mi cię brakowało, jeśli wyjedziesz z Japonii.
34275	Several men are fishing from the riverbank.	Na brzegu rzeki kilka osób łowi ryby.
20100	It seemed like you weren't interested.	Wyglądałeś, jakbyś nie był zainteresowany.
31908	Are things OK with you?	Czy wszystko jest z tobą w porządku?
28751	How much money did Tom give you?	Ile pieniędzy dał ci Tomek?
20497	This is the first time I've heard that word.	Pierwszy raz słyszę to słowo.
43080	Do you think I'm too old to go back to school?	Myślisz, że jestem za stary, żeby wracać do nauki?
19248	He is already here.	On już tu jest.
4870	Tom removed the key from the door.	Tom wyjął klucz z drzwi.
37155	"""That's a huge shrimp,"" said Tom."	„To ogromna krewetka”, powiedział Tom.
43020	Tom hopes that Mary will like the present he bought for her.	Tom ma nadzieję, że Mary spodoba się prezent, który dla niej kupił.
39851	You should go home. It's getting late.	Powinieneś iść do domu. Robi się późno.
6283	Can I eat my lunch here?	Czy mogę zjeść tu obiad?
25607	I used to take a walk every morning.	Miałem w zwyczaju iść na spacer każdego ranka.
22824	I think we should use our time a bit more constructively.	Myślę, że powinniśmy nieco konstruktywniej wykorzystywać czas.
44346	I figured I might find you here.	Pomyślałem, że mogę cię tu znaleźć.
22686	We've known each other for three years.	Znamy się od trzech lat.
42876	I know Tom misses you.	Wiem, że Tom za tobą tęskni.
5276	I hate these words.	Nie znoszę tych słów.
25699	It is terrible weather today.	Dzisiaj jest fatalna pogoda.
1873	Have you decided already?	Czy zdecydowałeś się już?
15202	The bad thing about inferiority complexes is that the wrong people have them.	Najgorsze w kompleksie niższości jest to, że mają go nie ci ludzie, którzy powinni.
40069	It's very easy to sound natural in your own native language, and very easy to sound unnatural in your non-native language.	Jest bardzo łatwo brzmieć naturalnie w swoim ojczystym języku i bardzo łatwo brzmieć nienaturalnie w obcym.
43804	We hoped he would come and help us at once.	Mieliśmy nadzieję, że natychmiast przyjdzie i nam pomoże.
30694	There's a good chance that taxes will increase.	Jest spore prawdopodobieństwo, że podatki zostaną podniesione.
16960	He shrank back in the face of danger.	Cofnął się w obliczu niebezpieczeństwa.
25163	OK, Tom, let's cut to the chase.	Dobra Tom, przejdźmy do rzeczy.
18477	Tom handed Mary a beer.	Tom podał Mary piwo.
22662	It is too warm for me.	Jest dla mnie za ciepło.
15955	I'll try to get everything we need.	Postaram się zdobyć wszystko czego potrzebujemy.
15957	We both have the same name.	Oboje mamy to samo imię.
10158	She takes cooking lessons once a week.	Raz w tygodniu chodzi na lekcje gotowania.
10195	Do you see what I'm getting at?	Widzisz do czego dążę?
16498	You could've told me the truth.	Mogłeś był powiedzieć mi prawdę.
42384	Have you met her before?	Czy już ją wcześniej spotkałeś?
42944	He's just gone on leave.	Zwyczajnie poszedł na przepustkę.
30600	Tom dressed like a girl for Halloween.	Tom przebrał się na Halloween za dziewczynę.
10439	I forgot to attach a stamp to the envelope.	Zapomniałem nakleić znaczek na kopertę.
22775	It was dark, so Tom had trouble reading the street sign.	Było ciemno, więc Tom miał problem z odczytaniem znaku drogowego.
38552	I'm not used to making speeches in public.	Nie jestem przyzwyczajona do wystąpień publicznych.
10532	I'm really in love with you.	Jestem w tobie naprawdę zakochany.
42692	Tom won't tell Mary anything.	Tom nic nie powie Mary.
38896	My grades are above average.	Moje stopnie są powyżej średniej.
39893	Go and see for yourself what has happened.	Idź i sam zobacz, co się wydarzyło.
32491	I'd like you to drive.	Chciałbym, żebyś prowadził.
8455	I don't need a car that big.	Nie potrzebuję samochodu tej wielkości.
11645	Why is he here?	Czemu on tu jest?
28456	This book is missing two pages.	W książce brakuje dwóch stron.
6660	Earthquakes frequently hit Japan.	Trzęsienia ziemi często są w Japonii.
15720	Are you sure you don't want me to buy you something at the supermarket?	Na pewno nie chcesz, żebym ci coś kupił w supermarkecie?
23809	Sooner or later, we'll do it.	Prędzej czy później to zrobimy.
41966	Hi! How are you?	Cześć! Jak się masz?
32532	I want to sleep.	Chce mi się spać.
6431	I put on my cap to go out.	Założyłem czapkę przed wyjściem.
41202	May I eat this orange?	Czy mogę zjeść tą pomarańczę?
45199	Does the room have air conditioning?	Czy pokój ma klimatyzację?
28137	If you wish, you can go.	Jeśli chcesz, możesz iść.
10917	I never got a chance to congratulate you.	Nie miałam szansy ci pogratulować.
27095	After all, he's your boss.	Mimo wszystko, jest twoim szefem.
26628	Birds are natural enemies of insects.	Ptaki są naturalnymi wrogami owadów.
45494	This man is dead.	Ten człowiek jest martwy.
731	I really didn't understand it.	Naprawdę tego nie rozumiałam.
37770	Tom isn't married yet.	Tom jeszcze się nie ożenił.
28912	My family isn't rich.	Moja rodzina nie jest bogata.
21495	All in all, I enjoyed the lecture.	Wykład był w sumie fajny.
25434	What is in the garden?	Co jest w ogrodzie?
5226	Tom says he didn't know Mary wouldn't pass her French test.	Tom mówi, że nie wiedział, że Mary nie zda testu z francuskiego.
3663	I lent my friend some money.	Pożyczyłem przyjacielowi trochę pieniędzy.
8196	You should concentrate on one thing and learn to do it well.	Skup się na jednej rzeczy i naucz się jej najlepiej.
3858	He looked pretty tired.	Wyglądał na dość zmęczonego.
24563	I can't do it alone.	Nie umiem zrobić tego samemu.
9814	I was hurt by many people.	Wiele osób sprawiło mi przykrość.
10713	The interview was videotaped.	Rozmowa kwalifikacyjna była nagrana na wideo.
30972	I have the same trouble as you have.	Mam ten sam problem co ty.
3145	Tom has to wait another three hours.	Tom musi czekać kolejne trzy godziny.
4315	Tom said he wanted to tell you how to do that, but Mary told him not to.	Tom stwierdził, że chciał ci powiedzieć jak to zrobić, ale Mary powiedziała mu, żeby tego nie robił.
2235	Do you want to be an actor in a movie?	Chcesz zagrać w filmie?
40257	To my surprise, the anthropologist was accused of murder.	Ku mojemu zaskoczeniu antropolog został oskarżony o zabójstwo.
16359	He was too tired to study.	Był zbyt zmęczony, aby się uczyć.
20386	Let's play tennis this afternoon.	Zagrajmy w tenisa dziś po południu.
