	eng	srp
12007	Tom worked part-time at a fast-food restaurant for three months.	Том је добио хонорарни посао у ресторану брзе хране на три месеца.
11900	I wasn't nervous about it.	Nisam se unervozio zbog toga.
23664	Everyone but Tom has a hat on.	Сви осим Тома носе капу.
18138	I got off the bus.	Izašao sam iz autobusa.
13743	Tom helped us save a lot of money.	Tom nam je pomogao da uštedimo mnogo novca.
19333	If you want to be a pianist, you should practice every day, or at least almost every day.	Ако желиш да будеш пијаниста, треба да вежбаш сваки дан, или барем скоро сваки дан.
24505	Tom is buried in a small cemetery just outside of Boston.	Том је закопан на малом гробљу одмах изван Бостона.
15093	I've been working here for a long time.	Радила сам овде дуго.
1431	Tom wants to do that with me.	Том жели да то ради са мном.
22727	Is it true that you're going to study in Boston?	Da li je istina da ćeš da studiraš u Bostonu?
7314	I'm aware what day it is.	Свесна сам тога који је дан.
8802	What do you want to do about Tom?	Šta da radite sa Tomom?
22222	Just get out of there.	Samo se skloni odavde.
25067	I was staring at Tom and he was staring at me.	Гледао сам у Тома, а он је гледао у мене.
9127	It's too smoky here for me.	Ovde ima previše dima za mene.
23593	Do you think you can remember the way home?	Мислиш ли да можеш да запамтиш пут до куће?
21159	I've never slept in class.	Никад нисам спавао на часу.
7416	Are we safe now?	Jesmo li sada na sigurnom?
15830	Please don't make me eat that.	Molim te, ne teraj me da jedem to.
15259	I forgot to write the address on the envelope.	Zaboravila sam da napišem adresu na koverti.
1016	Tom wants to sing with us.	Том хоће да пева са нама.
14724	Sorry, I don't follow.	Izvini, nisam ispratio.
1197	Tom is almost always in his office on Mondays.	Том је скоро увек у канцеларији понедељеком.
4717	Tom and Mary are broke.	Tom i Meri su švorc.
17540	I'm sorry. I shouldn't have said that.	Oprosti. Nije trebalo da kažem to.
6160	Take this medicine when you feel bad.	Узми овај лек када се не осећаш добро.
10670	I found something, too.	I ja sam pronašla nešto.
347	I didn't dare to say anything.	Нисам се усудио да кажем било шта.
10092	If I were you, I'd ask Tom what he thinks.	Да сам на вашем месту, питала бих Тома шта мисли.
420	I don't know what to do with Tom.	Не знам шта да радим са Томом.
13156	I want to move out.	Желим да се одселим.
10622	Tom lives in a mansion.	Tom živi u palati.
1237	Does Tom really need a car?	Да ли је Тому потребан аутомобил?
11671	Are those your bags?	Da li su ovo tvoje torbe?
5751	Do you love your mother?	Da li voliš tvoju majku?
21066	Are you sure that it was Tom and not Mary who did that?	Јеси ли сигурна да је то урадио Том а не Мери?
22060	Does Tom like camping?	Да ли Том воли да иде на камповање?
10290	I want to know why Tom didn't want to do that.	Желим да знам зашто Том није желео да уради то.
24537	I needed the money desperately.	Очајнички ми треба новац.
25566	To be honest, I really don't know.	Iskren da budem, ne znam baš.
25487	Tom wants to sit near Mary.	Том хоће да седне поред Мери.
3034	The prisoners must be released.	Затвореници морају да се пусте.
4141	I can't help myself.	Ne mogu da se uzdržim.
18978	I think Tom is trying to tell us something.	Мислим да Том покушава нешто да нам каже.
24392	You don't need money now.	Не треба вам новац сада.
14732	I'm just going to run down to the bank.	Само ћу да тркнем до банке.
10329	Tom couldn't remember where he'd buried the money.	Том није могао да се сети где је закопао новац.
18878	If I were you, I'd go to Boston.	Да сам на вашем месту, отишао бих у Бостон.
13908	I'm not here for that.	Nisam ovde zbog toga.
8267	Tom has an adopted daughter.	Том има усвојену ћерку.
12	Maybe you can't hear me.	Možda ne možeš da me čuješ.
14733	Both of them have three kids.	Обоје имају троје деце.
22392	I'm worried about you.	Забринут сам за тебе.
6907	I wish you could stay the night.	Voleo bih da prespavaš.
10855	Tom and I had to work together, even though we hated each other.	Том и ја смо радили заједно, иако смо се мрзели међусобно.
11209	The firm went under due to lack of capital.	Firma je propala zbog nedostatka kapitala.
25534	You're a patient man.	Ти си стрпљив мушкарац.
16779	I hate everything about it.	Mrzim sve o tome.
10191	Have you ever tasted soup this good before?	Да ли си икад пре јео овако добру супу?
21046	Once more, please.	Још једном, молим вас.
22837	It was a dark and stormy night.	Bila je to mračna i olujna noć.
19131	Have you told Tom this?	Da li si ovo rekao Tomu?
5024	I'm tied up at the office.	Заглавио сам у канцеларији.
23556	Tom and I were suspended from school for fighting.	Тома и мене су суспендовали из школе због туче.
6007	Tom was surprised that Mary didn't know to swim.	Тоа је изненадило то што Мери не зна да плива.
16704	She was supposed to be here by noon.	Требало је да буде овде до поднева.
6873	She was in a hurry to see her father.	Журила је да види свог оца.
3974	Tom is hiding under the table.	Том се крије испод стола.
11842	I didn't know Tom was an ex-con.	Нисам знао да је Том преварант.
1672	Does Tom really need a car?	Требају ли Тому кола?
5289	That was very good.	Baš je bilo dobro.
717	Didn't you see Tom yesterday?	Зар ниси јуче видела Тома?
13351	Tom has been trying to convince Mary to quit smoking.	Том неко време покушава да убеди Мери да престане да пуши.
16471	No questions were asked.	Није било постављено ниједно питање.
6394	I like that name.	Допада ми се то име.
17010	I'm normally on time.	Обично стигнем на време.
12317	I'd be perfect for that job.	Био бих савршен за тај посао.
15084	We have to set the scene for negotiations.	Морамо да припремимо терен за преговоре.
22683	Let me just clarify that.	Само да појасним то.
22874	I've already written to Tom.	Već sam pisao Tomu.
11789	I haven't seen her for ages.	Odavno je nisam video.
8998	The quarterly growth of 1.2% means an annual growth rate of 4.8%.	Тромесечни раст од 1,2% значи годишњи раст од 4,9%.
24214	I got off the bus.	Изашао сам из аутобуса.
21419	I actually live not too far from here.	Заправо не живим много далеко одавде.
19473	I know almost nothing about you.	Ne znam skoro ništa o tebi.
4970	It was completely dark.	Био је мркли мрак.
19415	Tom knows what it takes.	Tom zna šta je potrebno.
18636	Tom and I both have new bicycles.	И Том и ја имамо нове бицикле.
19074	Tom isn't like the other boys.	Tom nije kao ostali momci.
8823	The weather, indeed, affects bicycling more than any other sport.	Временске прилике, заиста, утичу на бициклизам више него на било који други спорт.
5301	I didn't intend to tell you that.	Nisam nameravala da ti kažem to.
22017	I think you can talk Tom out of it.	Ја мислим да ви можете да одговорите Тома.
16486	I'd like to have lunch with you.	Волела бих да ручам са тобом.
2194	We spent all day looking for Tom.	Провели смо цео дан тражећи Тома.
4920	I locked the door behind me.	Закључао сам врата за собом.
3071	Did you expect something else to happen?	Da li si očekivao da se dogodi nešto drugo?
21953	You'd help us, wouldn't you?	Помогао би нам, зар не?
14217	Tom still seems shaken.	Tom još uvek deluje potreseno.
11569	I'd probably be able to fix that fairly quickly.	Вероватно бих прилично брзо могао да решим тај проблем.
8406	Does Tom really like it?	Да ли се то Тому стварно свиђа?
12612	I thought you were happy here.	Mislio sam da si srećan ovde.
4009	It must've been quick.	Sigurno je bilo brzo.
25105	I think Tom is strict.	Мислим да је Том строг.
16395	I think that you've come a long way.	Мислим да си далеко догурала.
21791	Is it OK if I close the door?	Да ли је у реду да затворим врата?
15651	I don't want you to see me naked.	Ne želim da me vidiš golog.
368	Tom said nobody was hurt.	Tom je rekao da niko nije bio povređen.
13783	Don't argue with me.	Ne raspravljaj se sa mnom!
22359	She divorced her husband.	Razvela se od muža.
13097	I often get depressed.	Често паднем у депресију.
19447	Somebody stole my camera.	Неко ми је украо фото-апарат.
10655	I'm the one who should resign.	Ја сам тај који треба да поднесе оставку.
2481	They needed one another.	Potrebni su jedni drugima.
23240	I thought it was possible.	Mislio sam da je moguće.
16352	Does Tom want another beer?	Да ли Тому треба још једно пиво?
23902	The TV isn't plugged in.	TV nije uključen u struju.
1691	I think that it's Tom.	Мислим да је то то Том.
14284	How soon do you think you'll be able to do that?	Колико брзо мислите да ћете моћи да урадите то?
11699	Is anyone going to translate that?	Хоће ли неко превести то?
19232	I felt as calm as ever.	Био сам потпуно миран.
7584	I'm afraid they both have bad reputations.	Бојим се да обоје имају лошу репутацију.
4541	It just happened again.	Upravo se opet desilo.
20050	I'll be busy tomorrow.	Сутра ћу бити заузета.
4308	Tom led his horse out of the stable.	Том је извео коња из штале.
6389	You're still mad, aren't you?	Још увек си бесна, зар не?
24315	The guy talking to Mary is Tom.	Момак који прича с Мери је Том.
21311	What do you want now?	Šta je to što sada želiš?
9394	Tom is going to be thirty years old in three months.	Том ће напунити тридесет година за три месеца.
1917	She bought the dictionary, too.	Ona je takođe kupila rečnik.
17478	The two men were business partners.	Dvojica muškaraca su bili partneri u biznisu.
1582	You can't get much better than that.	Не можете да будете нешто много бољи од тога.
17850	I heard you don't eat meat.	Čuo sam da ne jedeš meso.
24370	Do you eat a lot of bread?	Да ли једеш пуно хлеба?
24179	Did Tom remember you?	Да ли те се Том сећа?
25385	I totally disagree with you.	U potpunosti se ne slažem sa tobom.
4803	Tom used to be scared of me.	Tom se ranije plašio mene.
23632	Tell me what I must do.	Reci mi šta moram da uradim.
25298	Do you agree with that?	Да ли се слажете са тим?
12194	He must be over sixty.	Сигурно има више од шездесет година.
1817	Are you saying that my life is in danger?	Кажеш да ми је живот у опасности?
24202	It doesn't seem to help.	Ne izgleda da pomaže.
10795	I'll try to answer any question you may have.	Пробаћу да дам одговор на сва питања која имате.
19665	Tom and I are very close friends.	Tom i ja smo jako bliski prijatelji.
12954	You deserve to be congratulated.	Zaslužuješ da ti čestitam.
6733	I'll eat when I have time.	Јешћу када будем имао времена.
24174	Tom showed up at 2:30.	Том се појавио у 2:30.
9831	I didn't recognize the song Tom was singing.	Нисам препознао песму коју је Том певао.
13508	Tom is going to do that unless you stop him.	Том ће да уради то осим ако га не спречиш.
20705	Is Mary a real blonde?	Da li je Meri prirodno plava?
9399	I'm sure Tom won't help us.	Siguran sam da nam Tom neće pomoći.
15056	Do you really think I'm selfish?	Da li zaista misliš da sam sebičan?
5705	I have confidence in you.	Ja imam poverenje u tebe.
19841	Does Tom play video games?	Да ли Том игра видео-игре?
14621	I met Tom in the winter three years ago.	Упознала сам Тома у шуми пре три године.
5792	My birthday is on a Monday next year.	Рођендан ми се пада у понедељак следеће године.
5722	You must tell Tom everything.	Мораш Тому да кажеш све.
22914	I'd be hesitant to do that.	Оклевао бих да урадим то.
6213	I believe Tom did that.	Верујем да је Том то урадио.
16155	Do you remember how to do this?	Сећаш ли се како се ово ради?
858	I'm really happy about it.	Zbilja sam srećan zbog toga.
9379	The girl talking to Tom is Mary.	Девојчица која прича с Томом је Мери.
20630	Tomorrow I'll buy what I need.	Sutra ću da kupim šta mi treba.
19208	This is one of the most popular restaurants in town.	Ovo je jedan od najpopularnijih restorana u gradu.
1858	I assumed you'd go to Boston.	Претпоставио сам да ћеш отићи у Бостом.
1642	Tom can still recite a poem he wrote when he was thirteen.	Tom još uvek zna da izrecituje pesmu koju je napisao kada je imao trinaest godina.
5083	How did you get to school?	Како си дошао до школе?
19934	You don't seem to want to win.	Изгледа као да желиш да победиш.
19197	Cut it out, Tom.	Dosta više, Tome.
17771	I'll call them tomorrow when I come back.	Zvaću ih sutra kada se vratim.
17397	What did you see after that?	Шта сте виделе после тога?
20170	I might be the only one here who doesn't understand French.	Можда сам једини овде који не разуме француски.
16091	I'll be declaring bankruptcy.	Објавићу да смо банкротирали.
14853	I think it's absolutely ridiculous.	Mislim da je to skroz smešno.
15505	I think that won't work.	Мислим да то неће успети.
3050	It's not something anyone can do.	То није нешто што би свако могао да уради.
9054	I no longer wonder about anything.	Више се ни за шта не чудим,
12870	I let Tom do what he wanted.	Дала сам Тому да ради шта хоће.
8693	Tom was a diplomat.	Том је био дипломата.
10252	I didn't think I was in any danger.	Нисам мислио да сам у опасности.
6360	Does Tom need a flashlight?	Да ли Тому треба батеријска лампа?
8613	It didn't get that bad.	Nije se toliko pogoršalo.
18936	You should do that again.	Треба да опет урадиш то.
3023	Would you mind if I told Tom about this?	Da li bi ti smetalo da kažem Tomu za ovo?
18431	What do you eat, anyway?	Šta ti uopšte jedeš?
2625	Tom finished writing the report in less than three hours.	Tom je završio izveštaj pre manje od tri sata.
14050	Tom watched Mary and John playing tennis.	Том је гледао Мери и Џона како играју тенис.
20350	Did you turn off the TV?	Да ли си ти искључио ТВ?
3520	The room was dark.	Soba je bila mračna.
3608	I know Tom isn't a very good heavy metal guitarist.	Знам да Том није много добар хеви метал гитариста.
11130	Antelopes can easily outrun lions.	Antilope mogu lako da pobegnu lavovima.
8795	I've never noticed that before.	Nikad ranije nisam opazio to.
12963	I don't quite understand what you're getting at.	Ne razumem baš na šta ciljaš.
14856	Tom wants to do that another way.	Том хоће да уради то на други начин.
9260	I know everyone here.	Знам све људе овде.
21248	Does that happen a lot?	Da li se to događa često?
10650	I think I'm unbeatable.	Мислим да сам непобедива.
17331	I can't sit still.	Ја не могу мирно да седим.
1483	Are you back already?	Јесте ли се већ вратили?
2620	Many people didn't like Tom.	Многим људима се није допао Том.
5088	You don’t want to sleep, do you?	Не желиш да спаваш, зар не?
3533	There's more to it than that.	Има ту још тога.
3955	Does Tom like traveling?	Да ли Том воли да путује?
22004	I'm different from Tom.	Другачија сам од Тома.
10773	I've had so much support.	Imao sam tako puno podrške.
11371	There's a problem there that you don't see.	Ту има један проблем који не видите.
18341	I no longer wonder about anything.	Више се не чудим ничему.
9913	This should do the trick.	Trebalo bi da upali.
21566	Nobody complained about that.	Нико се није жалио за то.
16701	This is the news I've been waiting for.	На ове вести сам чекао.
22889	Tom wants to stand out.	Том жели да се истакне.
5953	I would never do that.	Nikad ne bih uradio tako nešto.
22076	I'm not counting on it.	Ne računam na to.
9354	I fixed something to eat.	Спремио сам нешто за јело.
21793	How did you find out about what happened?	Како сте сазнали шта се десило?
9593	You never arrive on time.	Никад не стижеш на време.
4799	I'm sure you're very busy.	Siguran sam da si veoma zauzet.
17393	There's a good chance that we'll win.	Postoje dobre šanse da ćemo da pobedimo.
12070	Let's try something.	Hajde da probamo nešto.
16153	Tom wants to work here.	Том хоће да ради овде.
25513	Tom was there physically, but not mentally.	Tom je fizički bio tu, ali ne i mentalno.
9165	Nobody I know goes there anymore because it's too crowded.	Niko kog znam više ne ide tamo jer je velika gužva.
642	I think I'm ready now.	Мислим да сам сада спреман.
15735	Tom likes them both.	Tomu se dopadaju oboje.
572	Swimming makes your legs stronger.	Plivanje čini tvoje noge jačim.
10111	I think that I'm unlucky.	Мислим да сам несрећан.
1280	That's not a good sign.	То није добар знак.
9590	I've already done most of what I have to do today.	Већ сам урадио већину онога што је требало за данас.
18837	I first met Tom several years ago.	Упознао сам Тома пре неколико година.
11347	I'm having trouble deciding where to park.	Ne mogu da odlučim gde da se parkiram.
5430	I hope that the weather will be dry.	Nadam se da će biti suvo vreme.
17270	I really don't know how many songs I've written.	Стварно не знам колико сам песама написала.
24262	Hold this, please.	Придржи ово, молим те.
3828	I just met Tom.	Само што сам се упознала с Томом.
7748	Are we starting soon?	Da li počinjemo uskoro?
9009	It was a big explosion.	To je bila velika eksplozija.
13548	We should do this, too.	Требало би да и ми урадимо ово.
17471	That would be a huge waste of money.	To bi bilo veliko traćenje novca.
22326	Mary wore a bright pink scarf.	Мери је носила светли розе шал.
19907	We didn't really know why until recently.	Уопште нисмо знали зашто све до скора.
4013	Tell them we're coming.	Reci im da dolazimo.
13954	I gave my mother a red rose.	Дао сам својој мајци црвену ружу.
16427	If you do that for me, I'd appreciate it.	Ако ми средиш то, био бих ти захвалан.
16176	Tom named his third son after his grandfather.	Том је назвао свог трећег сина по свом деди.
13643	I expected you to get here earlier.	Очекивао сам да ћете раније да дођете овде.
5805	Doing that was harder than I thought it would be.	Урадити то је било теже него што сам мислио да ће бити.
5317	Ducks make great pets.	Патке су одлични кућни љубимци.
17134	She was still weak after her illness.	Још увек је била слаба после болести.
18371	It would take me too much time to explain to you why it's not going to work.	Требаће ми превише времена да ти објасним зашто неће да ради.
3251	How many symphonies did Beethoven write?	Koliko simfonija je napisao Betoven?
19223	Indeed, in hot weather it is important not to encase the ankles in heavy boots or leggings, as these would ensure overheating.	Заиста, током врућина је важно да чланци не буту прекривени дебелим чизмама или чарапама, јер би се тиме осигурало прегревање.
4080	I'm interested in mathematics.	Занимам се за математику.
4510	And then something amazing happened.	I onda se nešto neverovatno dogodilo.
22693	I don't want anything from you.	Ne želim ništa od tebe.
10691	I can't believe that Tom kissed me.	Ne mogu da verujem da me je Tom poljubio.
4159	He made a killing by investing in the stock market.	Napravio je ogroman profit investirajući na tržište akcija.
5149	You've been really helpful.	Stvarno ste mi pomogli.
10263	You can sit with me.	Možete da sedite sa mnom.
16765	There were a lot of people at the train station this morning.	Било је много људи на железничкој станици овог јутра.
22167	I accidentally dropped my phone.	Случајно ми је испао телефон.
22250	Tom was delighted with the results.	Том је био презадовољан резултатима.
6	I like shuffling cards.	Волим да мешам карте.
17672	You can't get much better than that.	Не можете да будете нешто много боље од тога.
9730	That was very good.	Баш је било добро.
4082	What am I here for?	Šta ću ja ovde?
19976	She achieved her goal.	Postigla je svoj cilj.
19429	Tom's house has a huge basement.	Томова кућа има огроман подрум.
12757	Are you sure this is safe?	Da li ste sigurni da je ovo bezbedno?
14114	I think you've come a long way.	Мислим да си далеко догурала.
10278	I was very excited.	Bila sam veoma uzbuđena.
23003	I'm afraid you'll have to go.	Бојим се да ћете морати да идете.
13191	What did both of you do?	Šta ste vas dvoje uradili?
8792	Eat your soup while it's warm.	Jedite supu dok je vruća.
12390	That's not a good sign.	To nije dobar znak.
678	Coffee would be nice.	Kafa bi dobro došla.
17099	Two boys came running out of the room.	Два дечака су истрчала из собе.
10676	I think that Tom has a headache.	Мислим да Тома боли глава.
10416	I think Tom is callous.	Mislim da je Tom kvrgav.
3018	I ended up calling the police.	На крају сам позвала полицију.
1175	Tom knew that Mary had gone to a private school.	Том је знао да је Мери отишла у приватну школу.
24151	I consider that a good sign.	За мене је то добар знак.
24994	Tom wants to go with Mary.	Том жели да иде са Мери.
19364	Tom needs a good lawyer.	Тому треба добар адвокат.
10957	My phone is about to die.	Telefon će mi se uskoro ugasiti.
1028	Vehicles approaching pass each other on the right.	Возила која примичу једно другом се мимоилазе здесна.
13366	I think that's funny.	Мислим да је смешно.
23645	Tom isn't in trouble.	Том није у невољи.
16619	I was curious to see what was in the box.	Занимало ме је да видим шта је у кутији.
18904	Someone stole my camera.	Неко ми је украо фото-апарат.
22976	You're going to get injured if you're not careful.	Повредићеш се ако не будеш пажљива.
2145	It may not be a good idea to eat while you are running.	Možda nije dobra ideja da jedete dok trčite.
19303	Are you going back now?	Da li se sada vraćaš?
16446	We've just moved in.	Само што смо се уселили.
13689	Does Tom know who we are?	Да ли Том зна ко смо?
19795	I think I'm getting arthritis.	Мислим да добијам артритис.
