	eng	srp
994	Tom has promised to behave from now on.	Том је обећао да бити миран надаље.
12158	Tom looked out the window to see what was going on.	Том погледа кроз прозор да види шта се дешава.
18603	How often do you wash your hair?	Колико често переш косу?
8910	I didn't have to pay anything.	Нисам морала да платим ништа.
10861	I'm glad that you found the money you lost.	Drago mi je da si našao novac koji si izgubio.
9786	She was shy in her high school days.	Била је стидљива као средњошколка.
18321	Your voice reminds me of my late grandmother.	Твој глас ме подсећа на моју покојну баку.
5056	Things might've turned out better if you hadn't gone there.	Stvari bi možda ispale bolje da nisi otišao tamo.
1468	I got off at the wrong bus stop.	Izašao sam na pogrešnoj autobuskoj stanici.
3701	I want to play tennis on Monday.	Хоћу да играм тенис у понедељак.
15196	What did you write on the blackboard?	Шта си написао на табли?
18953	The book that I bought is on the desk.	Књига коју сам купио је на столу.
3741	Tom told me I should stay home.	Tom mi je rekao da treba da ostanem kući.
22105	Tom will forever be in our hearts.	Том ће заувек бити у нашим срцима.
6191	That shirt ought to be ironed.	Та мајица треба да се пегла.
19990	That must've been fun.	Mora da je bilo zabavno.
21940	Tom loves to drive.	Tom voli da vozi.
14980	I expected to be here all afternoon.	Очекивао сам да ћу бити овде целог поподнева.
3611	I had never seen anything like that before.	Nikad pre nisam video nešto tako.
1127	You called me a coward.	Назвали сте ме кукавицом.
10300	Tom got fired because he often made mistakes.	Том је отпуштен јер је често правио грешке.
13670	We're not very likely to do that together.	Мале су шансе да то урадимо заједно.
23031	Could I have a glass of wine?	Mogu li dobiti čašu vina?
10743	I knew that I'd find you here.	Знао сам да ћу те пронаћи овде.
5312	Tom told me that Mary was the one who stole my bicycle, but I don't believe him.	Том ми је рекао да је Мери та која ми је украла бицикл, али не верујем му.
22055	I'm not good with numbers.	Нисам добра с бројевима.
8187	What're you going to do with all this?	Šta nameravaš sa sa svim ovim?
2061	Just get out of my way.	Samo mi se gubi s puta.
19846	Traffic accidents happen every day.	Saobraćajne nesreće se dešavaju svakog dana.
19675	You should eat to live, not live to eat.	Треба да једеш да би живео, не да живиш да би јео.
5583	We can save a little time if we do what Tom suggests.	Možemo da uštedimo malo vremena ako uradimo ono što predlaže Tom.
75	I'm going to use what you give me.	Искористићу оно што си ми дала.
16581	What was Tom convicted of?	За шта је Том осуђен?
17575	Many factors need to be considered.	Много утицаја мора да се узме у обзир.
13675	Tom seemed busier than usual.	Izgledalo je da je Tom zauzetiji nego obično.
2390	May I talk to you?	Могу ли да попричам са тобом?
2569	I want to let Tom go.	Хоћу да пустим Тома да иде.
842	I'm going to stay for another few days.	Остаћу још пар дана.
8126	He's a man of many talents.	On je čovek sa mnogo talenata.
6618	I've already ordered it.	Već sam je poručio.
22606	I won't try to predict the future.	Neću pokušavati da predvidim budućnost.
14613	Are you being truthful?	Da li si iskren?
22817	I think that I know everybody here.	Мислим да знам сев људе овде.
20440	Let me take care of this.	Dopusti meni da se postaram za ovo.
1921	Seeing that it was raining, Tom took his umbrella.	Видевши да је пада киша, Том узе кишобран.
9119	How can I protect myself?	Kako mogu da se zaštitim?
17449	I know how tall Tom is.	Знам колико је Том висок.
4876	Tom always made me laugh.	Tom me uvek zasmeje.
11829	Please be honest with me.	Molim te, budi iskrena prema meni.
24217	Tom is from small town about three hundred kilometers from here.	Том је из малог драга на око триста километара одавде.
1396	Tom already knows I'm not very happy about it.	Том већ зна да нисам баш срећан због тога.
14735	I don't want to tell you my name.	Не желим да ти кажем своје име.
8199	Tom might be there.	Tom bi mogao da bude ovde.
21971	We continued walking for a while in silence.	НАставили смо да ходамо неко време у тишини.
12163	Are you going to the supermarket?	Да ли идеш у супермаркет?
880	I have to go to town.	Морам да идем до града.
5082	Let me know if there is anything I can do.	Реци ми ако могу да урадим нешто.
17287	I want to do that again someday.	Желим да поново некад урадим то.
14723	There's no way to save everybody.	Ne postoji način da se svi spasu.
6423	We have to learn the whole poem by heart.	Moramo da naučimo celu pesmu napamet.
20325	I've never danced with Tom.	Никад нисам плесала са Томом.
3807	You need to make a decision.	Moraš da doneseš odluku.
7195	But don't get me wrong.	Али немој погрешно да ме схватиш.
13448	I haven't read any of his letters.	Нисам прочитала ниједно од његових писама.
14060	I think I'll stay for a few more days.	Mislim da ću ostati još nekoliko dana.
18069	She dreamed of becoming a nurse.	Маштала је да постане медицинска сестра.
3795	She was at a loss as to what to do.	Није имала појма шта да ради.
13469	No one knows what will come of it.	Нико не зна како ће да испадне.
23420	Tom is a bookworm.	Том је књишки мољац.
21432	Tom is the team manager.	Tom je menažder tima.
1354	Tom tried the knob.	Tom je probao dugme.
16575	Let's hope you're right.	Nadajmo se da si u pravu.
18114	Tell me what that is.	Kažite mi šta je ono.
6538	The next time will surely be better.	Sledeći put će zasigurno biti bolje.
19365	I'm still not ready yet.	Još uvek nisam spreman.
20427	Who sent Tom there?	Ко је послао Тома тамо?
18944	We sell clothing in our store.	Продајемо одећу у нашој продавници.
6823	I'm a thirteen-year-old girl.	Ја сам тринаестогодишња девојчица.
21058	It's been over a year since the accident.	Прошло је више од годину дана од несреће.
1329	The way to a man's heart is through his stomach.	Пут до мушког срца води преко његовог стомака.
21770	You'll feel better after a cup of tea.	Осећаћеш се боље после шоље чаја.
19725	What exactly are we looking for?	Шта то ми уствари тражимо?
2465	I got up later than usual.	Пробудио сам се касније него обично.
1308	Turn back, please.	Окрени се, молим те.
6326	That wasn't the first time that Tom got arrested.	То није био први пут да ухапсе Тома.
3224	Give me an example.	Дајте ми један пример.
6911	I'm really happy I'm here.	Zaista sam srećna što sam ovde.
8607	I really hope I'm wrong.	Stvarno se nadam da grešim.
21885	I told Tom I'd seen Mary.	Рекао сам Тому да сам видео Мери.
22752	Tom sat on the bench and closed his eyes.	Том је сео на клупу и зажмурио.
2039	Tom has never worn the socks that I gave him for Christmas.	Том никад није носио чарапе које сам му дао за Божић.
22534	I'm glad you're going to be there.	Драго ми је што ћеш бити тамо.
9740	The whole country is talking about it.	Цела држава о томе бруји!
3728	I don't really know what I need to do.	Не знам баш шта треба да радим.
24310	Everything is very complicated.	Све је било много компликовано.
11986	Does Tom do drugs?	Да ли се Том дрогира?
3146	I think that'll work.	Мислим да ће то упалити.
10258	The judge banged his gavel.	Sudija je lupio čekićem.
23548	Will we see Tom again?	Hoćemo li ponovo da vidimo Toma?
1138	The battle lasted a week.	Bitka je trajala nedelju dana.
1952	Tom has asked not to be disturbed.	Том нас је замолио да га не узнемиравамо.
4005	What did both of you do?	Šta ste oboje uradili?
21723	I think that I'll call Tom first.	Мислим да ћу ја прва да позовем Тома.
12255	Tom asked me if I found what I was looking for.	Tom me je pitao da li sam našao ono što sam tražio.
10704	Tom pointed to the sky.	Tom pokaza ka nebu.
24889	Tom worked all his life.	Tom je radio čitavog života.
16301	How long will you stay in Boston?	Колико дуго остајете у Бостону?
8249	I think I can stay.	Мислим да могу да останем.
1911	How much money do we need?	Koliko novca nam treba?
19932	I'd like to have lunch with you.	Волела бих да ручам с тобом.
25063	I often wonder if I could do that.	Често се питам да ли бих могла да радим то.
4556	Tom decided he shouldn't do that.	Том одлучи да не ради то.
13052	I'm sure that Tom didn't mean to hurt you.	Sigurna sam da Tom nije želeo da te povredi.
13022	How did you find out where Tom was?	Kako si saznao gde je Tom?
21880	Tom wants to do that now.	Том хоће да то уради сада.
18292	He leads a hectic life.	On vodi buran život.
12668	I talked to Tom yesterday.	Pričao sam sa Tomom juče.
24771	Tom and I are very close friends.	Tom i ja smo veoma bliski drugari.
14543	Let me introduce you.	Дозволи да вас упознам.
24091	Does Tom need any money?	Да ли Тому треба новац?
12894	Can I ask you a question?	Mogu li da vas pitam nešto?
17380	The first step is always the hardest.	Први корак је увек најтежи.
12547	Tom hates his tiny bedroom.	Tom mrzi svoju malu spavaću sobu.
17067	I plan to stay home today.	Намеравам да данас останем кући.
15418	I'm almost as tall as my father.	Висок сам скоро колико мој отац.
5029	I hope Tom gets back safely.	Nadam se da će Tom da se vrati bezbedno.
3868	Tom asks me the same thing every time he sees me.	Tom me pita istu stvar svaki put kada me vidi.
10385	I'm likely to be here all afternoon.	Verovatno ću biti ovde celo popodne.
21041	Music is important to me.	Muzika mi je važna.
8439	Those who live in glass houses should not throw stones.	Ne treba se gađati kamenjem u staklenoj kući.
20581	We need you to help us.	Potrebna nam je tvoja pomoć.
15515	You should be safe here.	Овде би требало да си безбедан.
17988	A bird in the hand is worth two in the bush.	Боље врабац у руци, него голуб на грани.
8060	I think that was really mean of you.	Mislim da si se zaista loše poneo.
13176	Are you still jealous?	Jesi li i dalje ljubomoran?
10088	Let's discuss our options.	Hajde da prodiskutujemo opcije.
6576	You don't seem to like me very much.	Изгледа да ти нисам баш драг.
17852	I'm used to no one liking me.	Navikao sam se da se nikome ne sviđam.
24978	I'd like to introduce you to Tom.	Volela bih da te upoznam sa Tomom.
9599	Did you go and see Tom?	Jesi li otišao da vidiš Toma?
4269	Is Tom in the choir?	Да ли је Том на хору?
19351	Are you coming in, or are you going to stand there all day?	Мислиш ли да уђеш, или ћеш да стојиш тамо цео дан?
3073	I know who'll do that.	Знам ко ће шта да ради.
22758	Why do you do what you do?	Zašto radiš to što radiš?
18193	Tom and I quit.	Том и ја смо дали отказ.
14805	Take your time, Tom.	Samo polako, Tome.
11478	Is there a phone nearby?	Има ли неког телефона у близини?
4054	I have no intention of changing.	Ne nameravam da se promenim.
17510	I'm doing it, too.	И ја то радим.
10026	I assumed you were busy.	Pretpostavila sam da si zauzet.
13066	Tom was waiting for us outside.	Том нас је чекао напољу.
24620	The meeting will likely be canceled.	Састанак ће вероватно бити отказан.
1800	Does Tom need my assistance?	Треба ли Тому моја помоћ?
730	That's my job, not Tom's.	To je moj posao, a ne Tomov.
21774	Tom tried to get everybody out of the room.	Том је пробао да избаци све људе из сове.
15773	Give us some room here.	Daj nam malo prostora.
20530	It's what I'm used to.	Na to sam naviknut.
25122	I was very excited.	Bio sam veoma uzbuđen.
6528	I want to stand out.	Хоћу да се истичем.
22500	Keep children away from medicine.	Drži decu podalje od lekova.
23979	It's out of our hands.	Mi tu ništa ne možemo.
4526	I doubt if that would happen.	Сумњам да ће се то десити.
3574	Have you lost your way?	Да ли си се изгубила?
4850	I like my name.	Свиђа ми се моје име.
9293	I played tennis yesterday.	Играо сам тенис јуче.
11770	These shoes are very expensive.	Ове ципеле су јако скупе.
3534	I guess that's a yes.	"Претпостављам да је то ""да""."
17904	Tom said Mary thought that he might want to do that by himself.	Том је рекао да је Мери мислила да он можда жели да то уради сам.
25046	I'm sure I'll beat Tom next time.	Сигуран да са ћу победити Тома следећи пут.
11659	Tom soon discovered that he knew more about science than the teacher.	Том је убрзо открио да је знао више о науци него учитељ.
19170	I don't like Chinese food as much as I like Mexican food.	Не волим кинеску храну колико водим мексичку храну.
20978	I haven't written anything for months.	Nisam ništa pisao mesecima.
8587	You're just like your father.	Иста си као отац.
23712	You don't have to have read everything.	Не мораш да прочиташ све.
20418	That should've never happened.	Nikada nije trebalo ovo da se desi.
19370	I know that I'll make mistakes.	Знам да ћу грешити.
16942	I've already done that.	To sam već uradio.
15867	Can you explain to me how I can get to the airport?	Možeš li da mi objasniš kako da stignem do aerodroma?
17410	I beg you to reconsider.	Preklinjem vas da ponovo razmislite.
14169	It's a shame life is so short.	Штета што је живот тако кратак.
14190	Tom didn't think that you could do that.	Том није мислио да можеш да урадиш то.
10673	I've watched all of these movies.	Гледао сам све ове филмове.
1163	Do you think Tom is still alone?	Мислиш ли да је Том још увек сам?
19137	I've met some wonderful people.	Upoznao sam neke divne ljude.
1543	Tom is an expert on wine.	Том је експерт за вина.
5746	Tom will come back from Boston next Monday.	Tom će se vratiti iz Bostona sledećeg ponedeljka.
20639	How many students did you say there were?	Колико рече да је било студента?
10446	I don't like it when you bring work home.	Ne dopada mi se kada radiš kod kuće.
23360	I thought I was going to be happy here.	Мислила сам да ћу да будем срећна овде.
19342	Does Tom trust you?	Да ли вам Том верује?
23256	Didn't I tell you not to do that anymore?	Нисам ли ти рекао да не радиш то више?
9569	I expected Tom to help us.	Очекивао сам да ће Том да нам помогне.
13931	Tom already knows who needs to do that.	Том већ зна ко треба да уради то.
19397	Yesterday was Tom's birthday.	Јуче је Тому био рођендан.
1070	Tom and Mary hope that their next child will be a boy.	Том и Мери се надају да ће њихово следеће дете бити дечак.
25500	Tom tried his best.	Tom je dao sve od sebe.
4602	I'd buy you lunch if I had enough money.	Купила бих ти ручак да имам довољно пара.
9773	What am I doing here?	Шта ћу ја овде?
2275	I'm sure Tom is proud.	Sigurna sam da je Tom ponosan.
22273	I'm lost. Can you help me?	Изгубио сам се. Можеш ли да ми помогнеш?
17000	How many people were there?	Koliko je ljudi bilo tamo?
1766	I'm a real simple guy.	Ja sam stvarno jednostavan momak.
24050	Have you finished washing the dishes?	Jesi li završio sa pranjem sudova.
10006	Tom wants to settle down.	Том хоће да се скраси.
7861	I'm sure that Tom will come to the party.	Sigurna sam da će Tom doći na zabavu.
21888	They went in opposite directions.	Отишли су супротним смеровима.
