	eng	deu
404	I am from Ecuador.	Ich bin aus Ecuador.
196633	Most students study hard.	Die meisten Studenten studieren fleißig.
85557	Thank God that nobody was hurt.	Gott sei Dank, kam niemand zu Schaden.
57139	Where does this train go?	Wohin fährt der Zug?
19639	They built an extension to the office.	Sie bauten eine Erweiterung des Büros.
50859	After work, I go right home.	Nach Feierabend geh ich direkt nach Hause.
83707	The president appointed a new manager.	Der Vorsitzende ernannte einen neuen Geschäftsführer.
157830	Why didn't you tell Tom?	Warum hast du es Tom nicht gesagt?
94380	I'll do anything you ask me to do.	Ich werde alles tun, worum du mich bittest.
37403	Why are you so far away?	Warum seid ihr so weit weg?
3946	Tom is trying to get back into shape.	Tom versucht, wieder in Form zu kommen.
140447	I hear you've got a new girlfriend.	Ich höre, du hast eine neue Freundin.
191913	I'm not going to kiss you, Tom.	Ich werde dich nicht küssen, Tom.
99410	Tom has to go shopping now.	Tom muss jetzt einkaufen gehen.
42388	He rescued a boy from drowning.	Er errettete einen ertrinkenden Jungen.
181301	Tom wondered if it was true.	Tom fragte sich, ob das stimmte.
80304	She never wears pants.	Sie hat nie Hosen an.
24077	What did Tom steal?	Was hat Tom gestohlen?
196826	You're a little overweight.	Ihr seid leicht übergewichtig.
15263	This is only partially true.	Dies trifft nur teilweise zu.
117496	I stretched out my hand for the book.	Ich streckte meine Hand nach dem Buch aus.
34070	I should've apologized to Tom.	Ich hätte mich bei Tom entschuldigen sollen.
148703	Where do you buy your clothes?	Wo kaufen Sie Ihre Kleidung?
150422	Tom is still not married.	Tom ist immer noch nicht verheiratet.
125019	There's no food left in the house.	Es ist nichts zu essen mehr im Haus.
167060	Get to the point.	Komm endlich zur Sache!
127203	Einstein liked to play the violin.	Einstein spielte gerne Geige.
122534	I have to explain that to Tom.	Ich muss Tom das erklären.
113101	I feel very betrayed.	Ich fühle mich sehr betrogen.
104476	Tom took off his protective glasses.	Tom setzte seine Schutzbrille ab.
57499	He doesn't want you to know.	Er will nicht, dass Sie es wissen.
20520	Tom worked at a hospital.	Tom arbeitete in einem Krankenhaus.
16455	That boy is Tom.	Der Junge da ist Tom.
81278	Please feel free to ask questions.	Sie dürfen gerne Fragen stellen.
125349	What's the quickest way home?	Wie komme ich auf dem schnellsten Weg nach Hause?
83930	They are very big apples.	Es sind sehr große Äpfel.
44253	I received your message yesterday.	Ich habe eure Nachricht gestern bekommen.
156258	Why are we studying French?	Warum lernen wir Französisch?
80215	Are you still bored?	Langweilst du dich immer noch?
21482	Would you like another glass of wine?	Hättest du gerne noch ein Glas Wein?
187798	Are all swans white?	Sind alle Schwäne weiß?
122076	We carried out that plan.	Wir setzten diesen Plan in die Tat um.
46276	I wonder what Tom needs to do.	Ich wüsste gerne, was Tom tun muss.
96279	That's not how Tom sees it.	Das ist nicht so, wie Tom das sieht.
136730	Tom is in Boston now.	Tom ist jetzt in Boston.
8455	Your phone was off.	Dein Telefon war ausgeschaltet.
14359	The tsunami alert was cancelled.	Der Tsunamialarm wurde aufgehoben.
127339	Tom is apt to go to extremes.	Tom neigt, zum Äußersten zu gehen.
99551	Where's the loo?	Wo ist das Klo?
147478	The heating must be repaired.	Die Heizungsanlage muss repariert werden.
83915	I'm beginning to agree with you.	Langsam bin ich deiner Meinung.
196921	I'm not as heavy as Tom.	Ich bin nicht so schwer wie Tom.
38611	I feel like I can do anything.	Ich fühle mich, als ob ich alles tun kann.
164253	I hope you don't mind walking.	Ich hoffe, es macht euch nichts aus zu laufen.
165258	We became fast friends.	Wir wurden dicke Freunde.
193912	Where is my invite?	Wo ist meine Einladung?
82459	Maybe Tom is dead.	Vielleicht ist Tom tot.
139690	Moths are attracted by light.	Motten werden von Licht angezogen.
194435	I'm willing to let bygones be bygones.	Ich bin bereit, das Vergangene vergangen sein zu lassen.
106185	They were really cold.	Sie waren äußerst kalt.
31200	I don't want a job in Boston.	Ich möchte keine Arbeit in Boston.
171700	Tom can't read music.	Tom kann keine Noten lesen.
36033	Where did you take your socks off?	Wo haben Sie Ihre Socken ausgezogen?
101080	Somebody stole it from me.	Jemand hat es mir gestohlen.
53729	You knew I was married.	Sie wussten, dass ich verheiratet bin.
181121	I will go on foot.	Ich werde zu Fuß gehen.
29819	Are these books yours or mine?	Sind das deine oder meine Bücher?
63351	Tom planted a row of carrots.	Tom pflanzte eine Reihe Karotten an.
186331	Are you talking about my friend?	Sprichst du gerade von meinem Freund?
36536	I hope it rains.	Ich hoffe, es regnet.
7769	It's a windy day.	Es ist ein windiger Tag.
22855	She didn't want to get involved.	Sie wollte nichts damit zu tun haben.
55592	Do you want me to help you?	Soll ich euch helfen?
181389	Tom needs crutches to get around.	Tom braucht Krücken, um sich fortzubewegen.
76717	Give me my money back.	Gebt mir mein Geld zurück!
188492	He is very stingy with his money.	Er ist ein Geizkragen.
759	It's never easy to say goodbye.	Abschiednehmen fällt nie leicht.
123119	I get up at 6:30.	Ich stehe um 6 Uhr 30 auf.
169080	She has long arms and legs.	Sie hat lange Arme und Beine.
60139	We've been forgotten.	Man hat uns vergessen.
128827	What's it made from?	Woraus ist es hergestellt?
17454	How did you get up there?	Wie bist du dort hinaufgekommen?
113612	I interpreted your silence as consent.	Ich habe Ihr Schweigen als Zustimmung gewertet.
87769	Tom is quite young, isn't he?	Tom ist ziemlich jung, nicht wahr?
185169	Is it really possible?	Ist das wirklich möglich?
22723	Tom is 30 years old.	Tom ist 30 Jahre alt.
42317	I prefer walking to riding.	Ich gehe lieber zu Fuß, als dass ich reite.
140086	We're safe for now.	Wir sind vorerst in Sicherheit.
162150	Tom isn't a dentist.	Tom ist kein Zahnarzt.
12202	I'm hanging up my shirts.	Ich hänge meine Hemden auf.
143588	Tom can come, too.	Tom darf auch kommen.
174586	He put the key on the desk as usual.	Er legte den Schlüssel wie immer auf den Schreibtisch.
92476	I'm not an officer.	Ich bin kein Beamter.
98942	Have a good weekend, everyone.	Ich wünsche euch allen ein schönes Wochenende!
98371	This country is rich in coal.	Dieses Land ist reich an Kohle.
154305	I want to talk to you about this list.	Ich möchte mit euch über diese Liste reden.
5907	I look like Tom.	Ich sehe wie Tom aus.
148996	You and I make a good team.	Sie und ich sind ein gutes Team.
35828	I have to go to Boston.	Ich muss nach Boston fahren.
95630	A new topic came up in conversation.	In der Unterhaltung kam ein neues Thema auf.
28009	Why don't you give it another try?	Warum lässt du es nicht auf einen zweiten Versuch ankommen?
89429	The change in weather was sudden.	Der Wetterumschwung kam plötzlich.
155272	This book cost me a fortune.	Dieses Buch hat mich ein Vermögen gekostet.
24997	He fell asleep with the radio on.	Er ist bei laufendem Radio eingeschlafen.
193062	This is something Tom made for you.	Das hat Tom für dich gemacht.
91134	Aren't you feeling well?	Ist dir nicht wohl?
180411	I am married and have two children.	Ich bin verheiratet und habe zwei Kinder.
76017	I found it in the attic.	Ich fand es auf dem Dachboden.
154647	It was extremely funny.	Das war äußerst lustig.
131140	Tom made me say those things.	Tom hat mich dazu gebracht, diese Dinge zu sagen.
43914	Tom has a message for you.	Tom hat eine Nachricht für dich.
177331	You'd better not do it.	Ihr solltet es besser nicht machen.
154630	I don't feel angry.	Ich bin nicht wütend.
90234	What should we do first?	Was sollten wir als Erstes tun?
197866	How did you reply?	Wie hast du geantwortet?
134092	Tom has a small house.	Tom hat ein kleines Haus.
87867	It doesn't make sense to me.	Ich werde daraus nicht klug.
141932	Tom forgot to feed his dog yesterday.	Tom hat gestern vergessen, seinen Hund zu füttern.
90839	What's your boyfriend's name?	Wie heißt Ihr Freund?
171584	One after another, the animals died.	Die Tiere starben eins nach dem anderen.
78941	I want to dive into the river.	Ich möchte in den Fluss tauchen.
144939	It sounded too farfetched.	Das klang zu weit hergeholt.
122235	I'm sick of hearing about it.	Ich hab es satt, andauernd darüber zu hören.
113884	Chivalry isn't dead.	Die Ritterlichkeit ist nicht gestorben.
181988	The monkey climbed up the tree.	Der Affe ist auf den Baum geklettert.
73682	Tom wants to kill you, Mary.	Tom möchte dich töten, Mary.
21992	Does Tom have a raincoat?	Hat Tom eine Regenjacke?
104119	I wanted to be famous.	Ich wollte berühmt sein.
167908	I thought you might like one of these.	Ich dachte, du würdest einen davon mögen.
